cut_id,program_name,cut_type,announcement_date,announcement_year,effective_term,status,students_affected,faculty_affected,cip_code,notes,institution_id,institution_name_collegecuts,institution_city,institution_state_abbr,institution_state_full,institution_control,institution_url,institution_unitid,matched_unitid,match_method,in_financial_tracker,financial_warning_count,tracker_institution_name,tracker_control_label,tracker_sector,tracker_level,tracker_urbanization,tracker_category,tracker_enrollment_headcount_total,tracker_enrollment_pct_change_5yr,tracker_enrollment_decline_last_3_of_5,tracker_revenue_total,tracker_expenses_total,tracker_revenue_pct_change_5yr,tracker_revenue_decreased_5yr,tracker_revenue_10pct_drop_last_3_of_5,tracker_loss_amount,tracker_ended_2024_at_loss,tracker_losses_last_3_of_5,tracker_loss_years_last_5,tracker_loss_years_last_10,tracker_net_tuition_per_fte,tracker_net_tuition_per_fte_change_5yr,tracker_tuition_dependence_pct,tracker_staff_headcount_total,tracker_staff_headcount_instructional,tracker_staff_total_headcount_pct_change_5yr,tracker_staff_instructional_headcount_pct_change_5yr,tracker_pct_international_all,tracker_pct_international_undergraduate,tracker_pct_international_graduate,tracker_international_enrollment_pct_change_5yr,tracker_international_enrollment_pct_change_10yr,tracker_share_grad_students,tracker_federal_grants_contracts_pell_adjusted_pct_core_revenue,tracker_federal_grants_contracts_pell_adjusted_pct_change_5yr,tracker_state_funding_pct_core_revenue,tracker_state_funding_pct_change_5yr,tracker_endowment_value,tracker_endowment_pct_change_5yr,tracker_discount_rate,tracker_discount_pct_change_5yr,tracker_liquidity,tracker_liquidity_percentile_private_nfp,tracker_leverage,tracker_leverage_percentile_private_nfp,tracker_loan_pct_undergrad_federal_latest,tracker_loan_count_undergrad_federal_latest,tracker_loan_avg_undergrad_federal_latest,source_id,source_url,source_title,source_publication,source_published_at
97ee17d8-a96e-4bdc-9354-f0dc8074afe4,Adaptive Athletics Program (Wheelchair Basketball) Discontinued,department_closure,2026-01-15,2026,2025-26,confirmed,,,,Eastern Washington University announced the discontinuation of its Division I adaptive athletics program (wheelchair basketball) at the end of the 2025-26 academic season due to sustainability and financial challenges. The program was the first of its kind in the Pacific Northwest.,c086a865-9d23-446d-801d-194cfcd7a6e8,Eastern Washington University,Cheney,WA,Washington,Public,https://www.ewu.edu,,235097,normalized_name_state_fallback,TRUE,1,Eastern Washington University,Public,"Public, 4-year or above",Four or more years,Town: Fringe,"Degree-granting, primarily baccalaureate or above",18373,15.111835098051502,No,296916578,252142410,-5.334289894958273,Yes,No,44774168,No,No,0,0,8305.970876762722,-11.962849944482048,27.37544381910531,1431,620,-7.974276527331189,-2.97339593114241,0.00364665541827681,0.00325166364186327,0.00466109924257137,-86.0125260960334,-85.86497890295358,0.28024819027921405,0.02343311461850157,12.206343256586036,0.05250734940142138,88.09963317331841,48340888,,,,,,,,35,2539,6280,481d32ab-492f-42fc-9841-7911832ac6b3,https://www.kxly.com/news/eastern-washington-university-cuts-wheelchair-basketball-program/article_d29f0032-c281-47df-aebb-d8a207afbc3a.html,"Eastern Washington University's Discontinuation of Its Adaptive Athletics Program: Institutional Decision-Making, Fiscal Constraints, and the Landscape of Collegiate Wheelchair Basketball",KXLY,2026-01-15
d7db3ff3-4741-413c-bb09-c525c31f7d28,Football Program Suspended,program_suspension,2026-01-05,2026,2026-27,confirmed,,,,"Program suspended after multiple seasons of losses, financial unsustainability, and media investigations. Head coach Desmond Gumbs stepped down; intent to return in Division II.",2a83499e-4a8d-4cd5-922c-edced0a8ea6e,Lincoln University,Oakland,CA,California,Private non-profit,https://www.lincolnuca.edu,,117557,normalized_name_state_fallback,TRUE,3,Lincoln University,Private not-for-profit,"Private not-for-profit, 4-year or above",Four or more years,City: Large,"Degree-granting, primarily baccalaureate or above",623,-4.447852760736196,No,6436347,7596275,3.2659068101178743,No,No,-1159928,Yes,Yes,3,4,9603.720156555772,4.134711758386586,76.24668154156387,84,27,35.483870967741936,-22.857142857142858,0.6934189406099518,0.3617021276595745,0.967741935483871,-26.779661016949152,-14.792899408284024,0.5473515248796148,0,,0,,,,,,,,,,0,0,3739,26b094d6-5033-4681-9835-8e407e107e70,https://www.usatoday.com/story/sports/2026/01/08/lincoln-university-football-oakland-coach-program-suspend/88088321007/,Lincoln University football dreams unraveled: How a college team failed players,USA Today,2026-01-08
c81ed45f-a114-4ff9-8ea5-6bcd2fdc86b6,Staff Layoffs,staff_layoff,2025-12-26,2025,,confirmed,,33,,"Restructuring to address structural budget imbalances, cutting 33 positions and redesigning 30 others as part of $4 million realignment.",bdf08bf6-1b93-4a30-a6ca-9a3daaebbf10,Western Wyoming Community College,Rock Springs,WY,Wyoming,Public,https://www.westernwyoming.edu,,,unmatched,FALSE,0,,,,,,,,,,,,,,,,,,,,,,,,,,,,,,,,,,,,,,,,,,,,,,,,dbd219bf-5028-4896-acde-54193029b06e,https://www.wyomingnews.com/rocketminer/western-president-kirk-young-explains-where-rifs-occurred-reasoning-behind-decisions/article_dad6fbe4-fb28-42fe-8ebc-a79a8b7faea3.html,Western Wyoming Community College announces restructuring to meet long-term budget goals,Rocket Miner,2023-12-08
028e6be7-2dd3-464d-9447-8c775ff7312d,Staff layoff,staff_layoff,2025-12-17,2025,,confirmed,,16,,Lay offs as part of the Universitys efforts to achieve a 12:1 student-faculty ratio.,3040aa8e-ed93-40fb-9e4f-aa2114e1083f,Christian Brothers University,Memphis,TN,Tennessee,Private non-profit,https://www.cbu.edu/,,219833,normalized_name_state_fallback,TRUE,2,Christian Brothers University,Private not-for-profit,"Private not-for-profit, 4-year or above",Four or more years,City: Large,"Degree-granting, primarily baccalaureate or above",2366,1.5450643776824031,Yes,47273825,46791550,-0.12573780056209655,Yes,No,482275,No,No,2,3,12800.743832020997,-22.325954636869763,51.583338136907685,364,190,-6.905370843989769,-10.7981220657277,0.28402366863905326,0.06961077844311377,0.5621359223300971,622.5806451612902,1192.3076923076924,0.4353338968723584,0,,0.01345111274243043,,44330912,,,,,,,,29,350,8848,35f47036-31a2-43b1-95a2-0b4609bdce6f,https://www.actionnews5.com/2025/12/17/christian-brothers-university-announces-faculty-layoffs/,Christian Brothers University announces faculty layoffs,Action News 5,
3e920bc0-bb34-4097-a007-f70dfb1b3954,Staff layoff,staff_layoff,2025-12-15,2025,,confirmed,,114,,"The reduction accounts for 7.6% of full-time and part-time staff, according to a message from President Rob Manuel.",290d2258-ffec-47bf-a991-70b3010ee923,DePaul University,Chicago,IL,Illinois,Private non-profit,https://www.depaul.edu/,,144740,normalized_name_state_fallback,TRUE,3,DePaul University,Private not-for-profit,"Private not-for-profit, 4-year or above",Four or more years,City: Large,"Degree-granting, primarily baccalaureate or above",24433,-8.562553796639346,Yes,704466000,577824000,-5.2740136193508205,Yes,No,126642000,No,No,1,1,23694.250092061655,-21.34681555051969,63.93551995412128,3282,1721,-5.553956834532374,-6.314643440391943,0.11509024679736422,0.03731107316764687,0.2577726218097448,75.96996245306633,73.36621454993835,0.35280153890230426,0,,0.02613024346319169,39.726338453233446,1025211000,,,,,,,,46,6591,6317,6d1d093a-91a8-477b-b56c-6da438816b25,https://www.yahoo.com/news/articles/depaul-university-lays-off-114-194000783.html,DePaul lays off 114 staff members to help reduce budget shortfall,Yahoo News,2025-12-15
99ca38ea-837c-4ed5-90e5-c90503f029cd,Program suspension and Staff layoff,program_suspension,2025-12-09,2025,,confirmed,,10,,"The private liberal arts college announced it will cut theater, communication arts, and philosophy majors — all programs with low enrollment numbers.",21226c9c-9eb9-4bb2-8862-58b549d9179d,College of Idaho,Caldwell,ID,Idaho,Private non-profit,https://www.collegeofidaho.edu,,,unmatched,FALSE,0,,,,,,,,,,,,,,,,,,,,,,,,,,,,,,,,,,,,,,,,,,,,,,,,858a6fba-93b5-47c8-8523-689a536027a6,https://www.kivitv.com/canyon-county/college-of-idaho-cuts-three-majors-lays-off-10-employees-in-academic-restructuring,"Theater, Debate And Philosophy Dropped In College Of Idaho Cuts",Idaho6 News,
7ed928be-cea6-49e5-bf0d-21ed03f01aee,Institution closing,institution_closure,2025-12-09,2025,2025FA,confirmed,,,,University suspended operations due to financial challenges and enrollment decline.,433ded9d-077e-497c-843a-9b13aad6edd1,Martin University,Indianapolis,IN,Indiana,Private non-profit,https://www.martin.edu,,151810,normalized_name_state_fallback,TRUE,2,Martin University,Private not-for-profit,"Private not-for-profit, 4-year or above",Four or more years,City: Large,"Degree-granting, primarily baccalaureate or above",298,-27.669902912621357,Yes,7618377,6369299,35.864706340591454,No,No,1249078,No,No,1,2,12151.904494382024,-17.058520381431137,28.39238593731972,41,9,7.894736842105263,28.57142857142857,0.0134228187919463,0.01298701298701298,0.01492537313432835,100,100,0.22483221476510068,0,,0,-100,,,,,,,,,51,91,7900,c5d2bb0c-f771-4697-b951-1f2ac82bf774,https://www.wthr.com/article/news/education/martin-university-pausing-operations-end-2025-semester-college-indianapolis/531-de213904-c26d-443e-a54c-b62bebd2a2ea,"Martin University suspending operations amid financial challenges, enrollment drop",WTHR,2025-12-09
d7e36650-2dac-46c4-93c6-878580966d57,The college will drop the 11 majors and associated courses in the upcoming semester,program_suspension,2025-11-24,2025,2026-27,confirmed,,,,"Cornell College to cut courses, citing student enrollment and data",d8dd4147-d62f-4720-98ed-802f5d3cc57e,Cornell College,Mount Vernon,IA,Iowa,Private non-profit,https://www.cornellcollege.edu/,,153162,normalized_name_state_fallback,TRUE,2,Cornell College,Private not-for-profit,"Private not-for-profit, 4-year or above",Four or more years,Town: Fringe,"Degree-granting, primarily baccalaureate or above",1142,-0.08748906386701663,Yes,59548249,49380988,19.496242607799868,No,No,10167261,No,No,1,3,14315.497377622378,-17.38500374980885,27.501948881821864,297,94,2.061855670103093,-1.0526315789473684,0.02802101576182136,0.02807017543859649,0,-57.89473684210527,-51.51515151515152,0.00175131348511383,0,,0.00208576954703165,-85.72294004937085,100874798,,,,,,,,65,707,6861,557dd3e4-2607-49fd-b82b-f7e7d11b6ef8,https://www.kcrg.com/2025/11/24/cornell-college-cut-courses-citing-student-enrollment/,Changes to Academic Offerings at Cornell College,KCRG,2025-11-06
3574aefe-4cd6-4ab3-a877-f18993c30d58,Layoffs at Florida Solar Energy Center,staff_layoff,2025-11-21,2025,,confirmed,,57,,Layoffs due to decline in external research funding and federal energy research priorities shift; resulted in elimination of 57 positions at FSEC.,daef2397-64de-45e4-ba99-7b4f8ce8e880,University of Central Florida,Orlando,FL,Florida,Public,https://www.ucf.edu,,132903,normalized_name_state_fallback,TRUE,2,University of Central Florida,Public,"Public, 4-year or above",Four or more years,Suburb: Large,"Degree-granting, primarily baccalaureate or above",80755,0.469033815223071,No,1506706333,1450962550,-7.927327836397,Yes,No,55743783,No,Yes,3,3,4770.939729990357,-25.30384994452119,19.045047778398104,6443,2399,1.273184533165671,4.622764936764065,0.04668441582564547,0.03415796970842175,0.11875888600819604,20.37037037037037,124.94033412887828,0.14806513528574083,0.02009397906313837,-22.626437103320804,0.04062186671057846,47.131219864590456,201916665,,,,,,,,23,13429,6814,ff99e9e3-bc60-4b08-9e5e-a3c1dd300630,https://www.orlandosentinel.com/2025/11/21/ucf-lays-off-65-employees-most-tied-to-shifting-federal-priorities-school-says,UCF will lay off staff at Florida Solar Energy Center due to loss of research funding,Orlando Sentinel,2025-11-21
d492b6b1-f2e0-487f-b8e3-28a166ee0907,Staff reduction at Video Data Bank,staff_layoff,2025-11-17,2025,,confirmed,,20,,"Staff reductions affecting the Video Data Bank at SAIC eliminated 3 of 5 staff roles including the director, citing institutional financial pressures linked to declining international student enrollment; concern raised about the long-term viability of the collection and services.",0ca62372-4a93-4c61-88b5-e6fd416983bc,School of the Art Institute of Chicago,Chicago,IL,Illinois,Private non-profit,https://www.saic.edu,,143048,normalized_name_state_fallback,TRUE,2,School of the Art Institute of Chicago,Private not-for-profit,"Private not-for-profit, 4-year or above",Four or more years,City: Large,"Degree-granting, primarily baccalaureate or above",3597,-10.030015007503753,Yes,,148902072,,,No,,,No,0,0,37189.057414798895,-13.071516268424816,,1096,681,-5.760963026655202,-6.584362139917696,0.3060884070058382,0.2967032967032967,0.345985401459854,-18.50481125092524,10.21021021021021,0.19043647484014456,0,,0.00736706088549156,109.77457673994996,416852000,,,,,,,,37,1033,7023,49c6a41c-80e9-41ce-8163-8607d51d10b4,https://hyperallergic.com/1057696/school-of-the-art-institute-of-chicago-lays-off-20-workers/,Layoffs Put World-Renowned Chicago Video Art Collection in Jeopardy,HyperAllergic,2025-11-17
7a3b959f-8db6-4389-8b76-dd62524eec1c,University-wide IT and Research Support Staff,staff_layoff,2025-11-14,2025,,confirmed,38,,,"Harvard University laid off 38 IT workers on Nov 4, 2025 in HUIT amid broader university staffing reductions driven by federal funding cuts and endowment tax increases.",8a8c34db-71f4-453b-ac61-4b18b4fd4228,Harvard University,Cambridge,MA,Massachusetts,Private non-profit,https://www.harvard.edu,,166027,normalized_name_state_fallback,TRUE,3,Harvard University,Private not-for-profit,"Private not-for-profit, 4-year or above",Four or more years,City: Midsize,"Degree-granting, primarily baccalaureate or above",37558,-10.548503108104889,Yes,9433391000,6426911000,-0.07297201215334967,Yes,No,3006480000,No,No,1,2,41286.93782476259,-14.997625080754617,12.21312675367744,21201,2445,8.65621156211562,-2.4730753889110493,0.26894403322860644,0.18821590440873504,0.3074774810211226,-2.5094102885821834,24.182444061962137,0.6768997284200436,0,,0.07595803976184899,-12.062970624833198,53235205000,,,,,,,,4,404,7926,97302a71-f8bc-4eba-9ee7-9d63e81fa172,https://www.thecrimson.com/article/2025/11/14/huit-layoffs-financial/,HUIT Lays Off 38 IT Workers Amid Wider Harvard Staffing Cuts,The Harvard Crimson,2025-11-14
f2b49142-2bd8-4964-a339-f4c9dd13fc47,Institution closure,institution_closure,2025-11-12,2025,Spring 2026,confirmed,,,,100% environmentally-focused work college closing after 65+ years due to enrollment declines (38% drop 2021-2023) and persistent financial challenges.,bc548f51-6933-4445-80c3-f61bd134f14b,Sterling College,Craftsbury Common,VT,Vermont,Private non-profit,https://www.sterlingcollege.edu,,231095,normalized_name_state_fallback,TRUE,4,Sterling College,Private not-for-profit,"Private not-for-profit, 4-year or above",Four or more years,Rural: Remote,"Degree-granting, primarily baccalaureate or above",103,-54.22222222222223,Yes,6753613,6304606,-24.194481217894808,Yes,Yes,449007,No,No,1,2,11293.162162162162,-24.749343615583168,12.37402853850228,42,8,-12.5,-57.89473684210527,0.04854368932038835,0.04854368932038835,,-16.666666666666664,,,0,,0,,1155851,,,,,,,,37,29,6979,248ba316-8b31-4718-b7bf-e5510ea99ecc,https://www.insidehighered.com/news/quick-takes/2025/11/14/vermonts-sterling-college-close,Sterling College to Close,Inside Higher Ed,2025-11-14
2478811b-b93c-4cb0-a471-c790f9bc0396,Staff layoff,staff_layoff,2025-11-10,2025,,confirmed,,40,,"Rider University will eliminate 35 to 40 full-time faculty positions, cut salaries 14% across the board, and suspend retirement contributions as part of sweeping cost-saving measures.",282bbe52-be7f-43f6-b9f8-5ef0ab991593,Rider University,Lawrenceville,NJ,New Jersey,Private non-profit,https://www.rider.edu,,186283,normalized_name_state_fallback,TRUE,5,Rider University,Private not-for-profit,"Private not-for-profit, 4-year or above",Four or more years,Suburb: Large,"Degree-granting, primarily baccalaureate or above",4932,-9.03725562523054,Yes,122877000,141042000,-34.88879682981189,Yes,No,-18165000,Yes,Yes,5,7,18690.347071583514,-28.252199688288933,56.09674715365773,788,338,-34.55149501661129,-34.1130604288499,0.040551500405515,0.03782505910165484,0.04977777777777777,-2.912621359223301,-14.893617021276595,0.2281021897810219,0,,0.01685962984872813,-23.888685439062165,66827000,,,,,,,,58,1863,6513,765c7873-b6bd-423b-befd-ebc85303f431,"https://philanthropynewsdigest.org/news/other-sources/article/?id=16657194&title=Major-N.J.-univeristy-put-on-accreditation-probation,-plans-40-faculty-layoffs",Program Cuts Loom at Rider,Philanthropy News Digest,2025-11-14
b61c1961-4902-4827-b53f-846cd0e25052,Earth and Atmospheric Sciences,program_suspension,2025-11-10,2025,Fall 2026,confirmed,,4,,"Department elimination includes Geology, Meteorology & Climatology programs; some federal-required courses may continue.",bbe024d9-f8bd-47f4-9892-af9c821b7de8,University of Nebraska-Lincoln,Lincoln,NE,Nebraska,Public,https://www.unl.edu,,181464,normalized_name_state_fallback,TRUE,2,University of Nebraska-Lincoln,Public,"Public, 4-year or above",Four or more years,City: Large,"Degree-granting, primarily baccalaureate or above",25883,-9.771317018754791,Yes,1453397255,1288046268,7.095075661337937,No,No,165350987,No,No,1,1,10611.144803180145,-19.682103711014857,15.06034872757483,6481,1480,-2.2031084955485136,-10.897049969897653,0.06962098674805857,0.03102153724560363,0.2081929420109949,-41.493506493506494,-27.014985824220332,0.21786500792025656,0.02512733575798672,-23.65098975942926,0.00400811926951968,-75.87682062522593,1479930187,,,,,,,,33,6295,5783,5d0f3670-6ec3-42e0-9ec7-7d88e13a2829,https://www.highereddive.com/news/unl-chancellor-reduces-program-cuts-final-proposal/805361,UNL finalizes plan to cut four departments over faculty objections,Higher ED Drive,2025-11-10
f45efee8-ef58-43e9-8cf0-1f0a59534bc5,Performing Arts Department Closure,department_closure,2025-11-07,2025,Fall 2026,confirmed,,,,Huntington University will suspend enrollment for all performing arts programs effective Fall 2026 due to a 21% decline in enrollment since 2020. Current students will be allowed to complete their degrees.,4497acee-73a6-4320-8b12-9486989b70f8,Huntington University,Huntington,IN,Indiana,Private non-profit,https://www.huntington.edu,,150941,normalized_name_state_fallback,TRUE,2,Huntington University,Private not-for-profit,"Private not-for-profit, 4-year or above",Four or more years,Town: Distant,"Degree-granting, primarily baccalaureate or above",1716,9.090909090909092,No,38326710,38427288,5.325826256678864,No,No,-100578,Yes,Yes,4,6,15737.13799448022,-18.953753340828143,44.6327613301533,364,209,25.951557093425603,17.415730337078653,0.03846153846153846,0.03342428376534789,0.068,32,50,0.1456876456876457,0,,0.00397544045233581,-56.95843716284135,30269864,,,,,,,,39,502,6461,1b5c2ae9-332a-4e71-bba5-ebd0afa084ea,https://www.21alivenews.com/2025/11/07/huntington-university-students-react-performing-arts-cuts/#$0,Huntington University to suspend enrollment in performing arts programs,21alivenews,2025-11-08
0578f96c-f70e-4dcd-a2a6-9dc8829608be,Staff Reduction,staff_layoff,2025-11-07,2025,Spring 2026,confirmed,,15,,The college is eliminating roughly 17 staff positions — two of which are vacant,ebd3f5e0-7721-46d3-95a9-c37a8dc901c8,Keene State College,Keene,NH,New Hampshire,Public,https://www.keene.edu,,183062,normalized_name_state_fallback,TRUE,5,Keene State College,Public,"Public, 4-year or above",Four or more years,Town: Distant,"Degree-granting, primarily baccalaureate or above",3123,-19.840862422997947,Yes,101697280,102393164,-16.705432391770998,Yes,No,-695884,Yes,Yes,4,6,9132.01282916948,-28.893626911019123,26.59758648412229,598,244,-25.806451612903224,-36.29242819843342,0.00608389369196285,0.00544588155207624,0.01621621621621621,72.72727272727273,,0.05923791226384886,0.02524750672972686,71.89714827592353,0.11712615716317612,75.57019665502395,61452755,,,,,,,,67,1809,6194,3ce088b5-27cc-4c4a-8044-9d055e6ecf7a,https://vnews.com/2025/11/14/keene-state-staff-reductions,Keene State to lay off staff positions,Valley News,2025-11-14
0c9fc3ee-860b-4cd3-abaf-f4199d0a846e,"Faculty, Staff Positions Eliminated",program_suspension,2025-11-07,2025,,confirmed,,36,,"Campus consolidation prompted closure of PA program in Albuquerque, NM; 18 faculty received non-renewal notices.",a7d0f7d9-2f31-4faa-95f6-d0611935a291,University of St. Francis,Joliet,IL,Illinois,Private non-profit,https://www.stfrancis.edu,,148584,normalized_name_state_fallback,TRUE,4,University of St Francis,Private not-for-profit,"Private not-for-profit, 4-year or above",Four or more years,Suburb: Large,"Degree-granting, primarily baccalaureate or above",5174,-22.75306061510899,Yes,47166337,48144414,-24.371125355628575,Yes,No,-978077,Yes,No,2,2,13652.41824157765,-19.99678979892806,70.45275956027707,441,245,-23.4375,-21.221864951768488,0.0102435253189022,0.02580645161290322,0.00259440761026232,-48.54368932038835,-7.017543859649122,0.6704677232315424,0,,0.03212066017144407,49.65313593466165,31326661,,,,,,,,76,1063,4637,49171b21-611e-4955-a35a-3a943f171907,https://patch.com/illinois/joliet/university-st-francis-36-job-cuts-revealed-these-faculty-staff-positions-eliminated,"University of St. Francis Cuts Jobs, Academic Programs",Patch,2025-11-07
772b6502-6c03-4ba8-a141-b285433d6093,Institution closure,institution_closure,2025-11-06,2025,2025-2026,confirmed,,,,The college announced it will close after the 2025–26 academic year due to financial challenges.,74401437-6cd0-444e-9880-04cfb972820b,Trinity Christian College,Palos Heights,IL,Illinois,Private non-profit,https://www.trnty.edu,,149505,normalized_name_state_fallback,TRUE,4,Trinity Christian College,Private not-for-profit,"Private not-for-profit, 4-year or above",Four or more years,Suburb: Large,"Degree-granting, primarily baccalaureate or above",915,-37.199725463280714,Yes,33048723,32906308,-6.461392343780497,Yes,No,142415,No,Yes,3,6,13343.941565600882,-19.538254394234524,36.62155115645467,251,121,-16.05351170568562,-16.551724137931036,0.07759562841530054,0.08275058275058275,0,65.11627906976744,57.77777777777777,0.06229508196721312,0,,0.01013752010270973,-14.839042132243948,11047055,,,,,,,,56,459,6575,0f057f97-143e-4499-be63-d5d0223e9a89,https://patch.com/illinois/palos/shock-resignation-sadness-wake-trinity-christian-colleges-closure,Trinity Christian College Will Close,Patch,2025-11-06
b8f8aae3-2c23-4f3c-bc64-0e3c870e7ece,"Multiple departments including Campus Ministry, Office of Social Justice, and Mass Communication",staff_layoff,2025-10-29,2025,Fall 2025,confirmed,,46,,Layoffs represent 5.8% of full-time staff; affected departments include mission-critical areas supporting spiritual and social justice services.,a3401a31-4ec1-4c0d-b1f1-10bf1b02d072,Xavier University of Louisiana,New Orleans,LA,Louisiana,Private non-profit,https://www.xula.edu/,,160904,normalized_name_state_fallback,TRUE,0,Xavier University of Louisiana,Private not-for-profit,"Private not-for-profit, 4-year or above",Four or more years,City: Large,"Degree-granting, primarily baccalaureate or above",3580,2.5787965616045847,No,152132715,152082963,10.856491246428956,No,No,49752,No,No,2,4,12510.56673892846,-44.596513990137566,26.5535391253617,809,314,1.125,15.441176470588236,0.02541899441340782,0.02716823406478578,0.01833568406205923,31.88405797101449,-15.74074074074074,0.19804469273743017,0,,0.29611575021740943,20.86339025532032,182857477,,,,,,,,56,1457,6376,e4ba3284-516d-47c8-8c02-591bc7d1cc68,https://wgno.com/news/louisiana/orleans-parish/xavier-university-experiences-layoffs-among-full-time-staff/amp,Xavier lays off 46 staff members amid financial challenges,HBCU Digest,2025-10-29
f295fb4d-35db-4493-a313-2a7abc74ddea,Staff layoff,staff_layoff,2025-10-24,2025,,confirmed,,70,,70 jobs across all divisions have been affected.,a0e71ff0-bbcd-4170-8667-c13536f84f42,University of Louisiana at Lafayette,Lafayette,LA,Louisiana,Public,https://louisiana.edu,,160658,normalized_name_state_fallback,TRUE,2,University of Louisiana at Lafayette,Public,"Public, 4-year or above",Four or more years,City: Midsize,"Degree-granting, primarily baccalaureate or above",16810,-12.543572134644398,Yes,458324623,425524697,10.190972183402174,No,No,32799926,No,No,1,4,9137.308777309314,-24.757318819554463,26.006936354366456,2296,879,6.148867313915858,3.53356890459364,0.02873289708506841,0.00789622109419063,0.14127951256664129,-0.6172839506172839,-34.106412005457024,0.15621653777513386,0.07385875462872689,11.388254022465649,0.02767030380618742,40.41920579494331,177999227,,,,,,,,44,5762,6245,69761e82-d555-480a-ac8d-4fe84d2c4980,https://www.klfy.com/local/lafayette-parish/ul-lafayette-cuts-70-jobs-to-help-resolve-25m-deficit-interim-president/,UL-Lafayette cuts 70 jobs to help resolve $25M deficit: interim president,The Advocate,2025-10-24
