d4059c1f-c4b1-4b5e-b365-4d5aca339958,Satellite campuses (Oxnard and Westlake Village locations),program_suspension,2025-09-03,2025,Summer 2026,confirmed,,,,Satellite campus closures due to enrollment decline,51beac8d-d8f8-4aff-89f4-e6a8da7dbbad,California Lutheran University,Thousand Oaks,CA,California,Private non-profit,callutheran.edu,,110413,normalized_name_state_fallback,TRUE,4,California Lutheran University,Private not-for-profit,"Private not-for-profit, 4-year or above",Four or more years,City: Midsize,"Degree-granting, primarily baccalaureate or above",3925,-23.71234207968902,Yes,119647514,125938071,-21.326061162404184,Yes,No,-6290557,Yes,No,2,2,21823.503227789737,-9.670014317432894,59.33416719381231,822,402,-11.422413793103448,-16.075156576200417,0.09579617834394905,0.038671875,0.20293040293040293,-28.6527514231499,-47.04225352112676,0.34777070063694265,0,,0.04900876983108159,-8.715433405649046,144984195,,,,,,,,50,1185,6438,8646f655-0a8e-48f1-94d8-37c3fbb146f6,https://www.vcstar.com/story/news/education/schoolwatch/2025/09/03/clus-satellite-campuses-in-oxnard-westlake-village-to-close/85957259007/,"CLUs satellite campuses in Oxnard, Westlake Village to close",VC Star,2025-09-03
237db960-d67d-4e8d-94a4-43511018d30c,"Diversity, Equity, and Inclusion (DEI) programs and offices",department_closure,2025-09-03,2025,,confirmed,,,,Discontinued in response to Trump administration federal mandates against DEI programs. Interim President Leah Ward Sears announced the closure to comply with federal laws.,66a3db2d-6d10-493c-87eb-24258541d075,Emory University,Atlanta,GA,Georgia,Private non-profit,emory.edu,,139658,normalized_name_state_fallback,TRUE,1,Emory University,Private not-for-profit,"Private not-for-profit, 4-year or above",Four or more years,City: Large,"Degree-granting, primarily baccalaureate or above",16189,1.029705441837244,Yes,10461480000,9499041000,26.087954597133223,No,No,962439000,No,No,2,3,34526.639630820864,-11.067834405267895,4.7201734362633205,15092,2060,19.34208445358216,-24.12523020257827,0.182037185743406,0.17475976937860346,0.18881202290076335,3.3309957924263673,21.525773195876287,0.5178825128173451,0,,0.2222150694655027,33.2621930988634,12396185000,,,,,,,,11,781,6419,02e9fd9b-d250-4e25-bebd-e47605835099,https://www.emorywheel.com/article/2025/09/emory-ends-dei-programs,Emory ends DEI programs,The Emory Wheel,2025-09-03
710e4489-3193-4e4c-ad73-e1ac0e605aa4,Community Writing Center,department_closure,2025-09-03,2025,Summer 2026,confirmed,,,,"Community service center operating for 25 years, offering writing coaching and workshops. Closure saves $210,435 as part of HB 265 budget reallocation requirements.",7c500846-2da6-48f1-bed2-fbd8dcf4ab66,Salt Lake Community College,Salt Lake City,UT,Utah,Public,slcc.edu,,,unmatched,FALSE,0,,,,,,,,,,,,,,,,,,,,,,,,,,,,,,,,,,,,,,,,,,,,,,,,84636c2d-63ed-4c2a-8945-db5136bc0880,https://www.kuer.org/arts-culture-entertainment/2025-09-03/after-nearly-25-years-slcc-community-writing-center-will-close-due-to-budget-cuts,"After nearly 25 years, SLCC Community Writing Center will close due to budget cuts",KUER,2025-09-03
08b1cd81-2963-4a91-97b7-5d9ecbe61bec,Staff layoffs,staff_layoff,2025-08-31,2025,Fall 2025,confirmed,,15,,15 staff positions eliminated to place college on more sustainable financial path. No regular faculty positions were cut.,feea185b-a0fa-412f-a145-590b66cc4530,Bennington College,Bennington,VT,Vermont,Private non-profit,https://www.bennington.edu,,230816,normalized_name_state_fallback,TRUE,1,Bennington College,Private not-for-profit,"Private not-for-profit, 4-year or above",Four or more years,Town: Distant,"Degree-granting, primarily baccalaureate or above",943,6.433408577878104,No,54039554,53767398,-10.303245199905236,Yes,No,272156,No,No,2,3,27185.323692992213,-25.096957849894636,45.22540285954248,381,148,7.323943661971831,22.31404958677686,0.12513255567338283,0.13598074608904934,0.04464285714285714,-11.278195488721805,114.54545454545456,0.11876988335100742,0,,0.0478289837517942,336.75797445587415,48929885,,,,,,,,50,379,6181,16430583-87b0-41d3-ba60-9c368ed71caf,https://vtdigger.org/2025/08/19/bennington-college-announces-layoffs-of-15-staff-members/,Bennington College announces layoffs of 15 staff members,VTDigger,2025-08-19
284bcbf4-e2a1-4474-9522-a0b6ef0af65b,Institution-wide staff reduction,staff_layoff,2025-08-31,2025,,confirmed,,45,,45 staff layoffs due to Trump administration policies limiting international students; international students contributed $172M to budget in 2023,58c0e96a-c140-4889-bf0b-cb5cb5dccd7a,Stevens Institute of Technology,Hoboken,NJ,New Jersey,Private non-profit,https://www.stevens.edu,,186867,normalized_name_state_fallback,TRUE,0,Stevens Institute of Technology,Private not-for-profit,"Private not-for-profit, 4-year or above",Four or more years,Suburb: Large,"Degree-granting, primarily baccalaureate or above",9650,20.77596996245307,No,438372000,382464000,26.674879387704415,No,No,55908000,No,No,0,0,34271.745002701246,-7.624551146290448,57.88417143430693,1413,532,11.25984251968504,13.9186295503212,0.36393782383419687,0.03181818181818181,0.6177330895795247,51.18381403357727,112.46218995765275,0.566839378238342,0,,0.15765189852420652,70.49319892908669,374598000,,,,,,,,53,2157,6280,fe51b06a-6b77-4b53-adfe-c086a70c9c98,https://patch.com/new-jersey/hoboken/stevens-institute-technology-lays-45-employees-amid-trump-policy-changes,Stevens Institute of Technology Lays Off 45 Employees Amid Trump Policy Changes,Patch,
b5f601b6-e995-47f4-ad1c-08224d8f9f0d,Middlebury Institute of International Studies at Monterey,institution_closure,2025-08-28,2025,June 2027,confirmed,,,,Closing all residential graduate programs in Monterey due to $8.7M deficit and declining enrollment. Some online programs and research centers will continue.,9a8a73ec-1772-4c17-9146-ed404b7ee560,Middlebury College,Middlebury,VT,Vermont,Private non-profit,https://www.middlebury.edu,,230959,normalized_name_state_fallback,TRUE,5,Middlebury College,Private not-for-profit,"Private not-for-profit, 4-year or above",Four or more years,Town: Distant,"Degree-granting, primarily baccalaureate or above",4726,-0.5262050094716901,Yes,317559000,328127000,-13.12208184680436,Yes,No,-10568000,Yes,Yes,3,4,58005.66215791129,-9.634556071476446,58.067949577873726,1267,394,4.624277456647398,8.539944903581267,0.11701227253491324,0.11675493500240731,0.11888111888111888,12.627291242362526,16.42105263157895,0.12103258569614896,0,,0.03773910491963707,37.00181290647549,1597984000,,,,,,,,23,636,5965,47885bb0-54a6-498a-8210-f2774c9fc0dc,https://www.middleburycampus.com/article/2025/08/middlebury-to-close-miis-by-june-2027,Middlebury to close MIIS by June 2027,The Middlebury Campus,2025-08-28
fb2e8ebe-fac8-4416-be64-c6621a3100a9,"Multiple PhD programs across Arts & Humanities, Social Sciences, and professional schools",program_suspension,2025-08-28,2025,Fall 2026,confirmed,,400,,"$100M budget cut, 400 staff layoffs, PhD admissions paused in most humanities depts, federal funding cuts cited as primary cause",95d13455-ab72-441b-83c9-08dc144d4678,University of Chicago,Chicago,IL,Illinois,Private non-profit,https://uchicago.edu,,144050,normalized_name_state_fallback,TRUE,3,University of Chicago,Private not-for-profit,"Private not-for-profit, 4-year or above",Four or more years,City: Large,"Degree-granting, primarily baccalaureate or above",21145,7.558878884989063,No,5307925800,5326554945,-11.059762987078232,Yes,No,-18629145,Yes,Yes,4,6,42534.00166991372,-11.79418268165453,11.516714721219351,13908,3435,12.451487710219922,21.206774876499647,0.3187987703948924,0.19946362722091857,0.4063627418825845,25.390625,102.12893553223388,0.5767793804681958,0,,0.1784628694529723,22.457363131374784,9124340657,,,,,,,,5,359,6147,66e4b0b5-00e9-4180-b574-280db4e95f55,https://www.universityherald.com/articles/79750/20250829/university-chicago-cut-100m-lay-off-400-employees-amid-federal-policy-shifts.htm,"University of Chicago to Cut $100M, Lay Off 400 Employees Amid Federal Policy Shifts",University Herald,
53d0acd9-b519-40ab-b4bb-c82d6ad8e6bf,Bachelor of Arts in Chemistry & 10 Others,program_suspension,2025-08-26,2025,,confirmed,,,,11 programs suspended due to Advance Ohio Higher Education Act requiring 5+ annual graduates. Students can complete degrees. No immediate faculty impact expected.,b156b9fb-7a24-4986-841e-8263ff2b2049,Ohio University,Athens,OH,Ohio,Public,ohio.edu,,,unmatched,FALSE,0,,,,,,,,,,,,,,,,,,,,,,,,,,,,,,,,,,,,,,,,,,,,,,,,f6073eb6-8243-4b7b-994b-eb6481d4eb47,https://www.ohio.edu/news/2025/08/ohio-university-will-suspend-future-entry-11-academic-programs-comply-advance-ohio,Ohio University will suspend future entry into 11 academic programs to comply with Advance Ohio Higher Education Act standards,Ohio University,2025-08-26
80fdc926-a198-49b4-ac0d-222d12c28467,Staff Layoffs,staff_layoff,2025-08-23,2025,August 2025,confirmed,,30,,5% staff reduction (30+ employees) due to enrollment and revenue falling below projections for second consecutive year. 12 union members affected.,edd9de38-c4f0-4876-921f-d6c0fe87f9c9,Emerson College,Boston,MA,Massachusetts,Private non-profit,https://www.emerson.edu,165662,165662,collegecuts_institutions.unitid,TRUE,0,Emerson College,Private not-for-profit,"Private not-for-profit, 4-year or above",Four or more years,City: Large,"Degree-granting, primarily baccalaureate or above",5988,19.09307875894988,No,301422092,268215335,12.023184261616448,No,No,33206757,No,No,1,2,33446.907923299565,-14.969599537178109,61.340728469232445,1341,725,21.687840290381125,40.77669902912621,0.1372745490981964,0.1636828644501279,0.06994665085951393,35.86776859504132,120.37533512064344,0.2817301269205077,0,,0.00596577532925262,1049.4506130265377,264747512,,,,,,,,43,1800,6531,193a7313-80fd-4140-806e-9e3d33d519c8,https://berkeleybeacon.com/emerson-lays-off-5-of-staff-due-to-budget-reductions-offers-benefits-for-those-who-voluntarily-resign/,"5% of Emerson staff laid off, college says",The Berkeley Beacon,
8a0e9882-2511-4745-beb2-e2ed01b11950,Staff layoffs across multiple departments,staff_layoff,2025-08-22,2025,,confirmed,,30,,"Approximately 30 staff laid off due to financial challenges; enrollment dropped from 4016 to 3812 affected library, undergraduate, graduate and support staff across departments",4b199992-ecd5-4600-ab53-dfd0c3cac00d,School of Visual Arts,New York City,NY,New York,Private for-profit,sva.edu,,197151,normalized_name_state_fallback,TRUE,1,School of Visual Arts,Private for-profit,"Private for-profit, 4-year or above",Four or more years,City: Large,"Degree-granting, primarily baccalaureate or above",4198,-7.553402334287602,No,210938754,201443686,1.394170125685585,No,No,9495068,No,No,1,1,44094.38385583807,-5.304219932114813,84.68161758459993,1506,940,-10.03584229390681,-14.700544464609798,0.5333492139113863,0.5215068878268203,0.5990639625585024,2.5183150183150182,60.73223259152907,0.15269175797999046,,,,565.0761664056432,,,,,,,,,26,884,6946,85ec92e7-f743-436f-853d-c0db5ac3b08e,https://www.theartnewspaper.com/2025/08/22/new-york-school-of-visual-arts-lays-off-30-employees,New Yorks School of Visual Arts lays off 30 employees,The Art Newspaper,2025-08-22
91cc2dc7-a197-4e45-bb9c-57de383064e4,Public Defender Project,program_suspension,2025-08-22,2025,,confirmed,,1,,"Clinical program providing experiential learning in public defense work. Professor John Gross, director and Clinical Associate Professor, facing layoff.",ffafbe40-18a4-419c-8c90-e3636d3917e6,University of Wisconsin Law School,Madison,WI,Wisconsin,Public,https://law.wisc.edu,,,unmatched,FALSE,0,,,,,,,,,,,,,,,,,,,,,,,,,,,,,,,,,,,,,,,,,,,,,,,,2666c18d-790b-443e-9c9e-fc8530fff08b,https://www.instagram.com/p/DNqcDOotzmf/,Wisconsin Law Students & Alum: Save the Public Defender Project!,Instagram,2025-08-22
ddc23cea-20b3-4ad7-a4ff-ad26befc5955,"Diversity, Equity and Inclusion positions",staff_layoff,2025-08-21,2025,,confirmed,,4,,Four DEI positions eliminated in response to Trump administration federal DEI guidelines from U.S. Department of Education,a0ae2872-c094-4052-8576-fbfdb9095aed,Milwaukee Area Technical College,Milwaukee,WI,Wisconsin,Public,https://www.matc.edu,,,unmatched,FALSE,0,,,,,,,,,,,,,,,,,,,,,,,,,,,,,,,,,,,,,,,,,,,,,,,,962d82e3-e3f3-4822-b089-e0c1e9c65da4,https://drwebdomain.blog/2025/08/21/matc-cuts-four-positions-under-trumps-federal-dei-guidelines/,MATC cuts four positions under Trump's federal DEI guidelines,DrWeb Domain Blog,2025-08-21
786bd5e3-f1ed-417e-b486-c726e9e1a99b,Institution-wide staff reduction,staff_layoff,2025-08-21,2025,,confirmed,,50,,University of Texas Health Science Center at Houston laying off dozens (0.5% of staff) amid hiring freeze and cost controls due to financial headwinds. Part of broader healthcare industry layoff trend.,61796f40-2fa8-460a-8420-c24abb3cec59,University of Texas HSCH,Houston,TX,Texas,Public,www.uth.edu,,,unmatched,FALSE,0,,,,,,,,,,,,,,,,,,,,,,,,,,,,,,,,,,,,,,,,,,,,,,,,d3bbcbb5-8762-40a3-9fe6-d1abc81c6921,https://www.houstonchronicle.com/health/article/uthealth-houston-layoffs-freeze-20826193.php,UTHealth Houston lays off dozens during hiring freeze,Houston Chronicle,2025-08-21
b073465e-9d3b-44a7-a03d-7c2e510b7ca8,"Multiple programs: journalism, film, computer science, cybersecurity, information systems, Master of Arts in Coaching and Sports Management",program_suspension,2025-08-19,2025,Fall 2025,confirmed,,,,Six programs discontinued due to enrollment challenges and market changes. Current students can complete degrees.,fa358e55-cef2-4040-a1c0-2e73666ea384,Milligan University,Milligan,TN,Tennessee,Private non-profit,https://www.milligan.edu,,486901,normalized_name_state_fallback,TRUE,1,Milligan University,Private not-for-profit,"Private not-for-profit, 4-year or above",Four or more years,Suburb: Midsize,"Degree-granting, primarily baccalaureate or above",1299,-5.458515283842795,No,41803112,32403892,20.06769348811911,No,No,9399220,No,No,1,1,14168.21897810219,-18.04868219072581,41.78974522279585,317,155,3.594771241830065,-9.883720930232558,0.06851424172440339,0.0811764705882353,0.04454342984409799,34.84848484848485,,0.34565050038491146,0,,0.00445813993612613,-10.006594951174216,56151084,,,,,,,,45,376,6512,37458911-e5dd-41d5-9484-d83538980228,https://wcyb.com/news/local/milligan-to-no-longer-accept-students-into-multiple-programs-including-journalism,Milligan to no longer accept students into multiple programs including journalism,WCYB,2025-08-19
fe79272d-ed7d-4015-886b-a9a745c4870d,Rossier School of Education,staff_layoff,2025-08-19,2025,,confirmed,,19,,"Part of university-wide layoffs due to $200+ million budget deficit. 4 faculty and 15 staff laid off, including career services specialist. Multiple USC schools affected.",2f163a25-ee0d-4dd2-b262-56223e1739bd,University of Southern California,Los Angeles,CA,California,Private non-profit,https://www.usc.edu,123961,123961,collegecuts_institutions.unitid,TRUE,2,University of Southern California,Private not-for-profit,"Private not-for-profit, 4-year or above",Four or more years,City: Large,"Degree-granting, primarily baccalaureate or above",51953,-2.3182792464182302,Yes,8215984000,7619619000,22.682321501020432,No,No,596365000,No,No,1,2,45642.98773217456,-5.687420730978349,20.966593897943326,17359,4025,4.045792375929034,5.228758169934641,0.27059072623332625,0.1487148368081141,0.3679454331417492,11.288790373654212,47.142558090852,0.5559255480915443,0,,0.15917552496879722,28.26811597338058,8092846000,,,,,,,,24,4956,6197,e1dc7301-f6ff-4575-bd00-9d5945659bf1,https://www.uscannenbergmedia.com/2025/08/19/rossier-school-of-education-lays-off-19-including-lone-career-services-specialist/,"Rossier School of Education lays off 19, including lone career services specialist",USC Annenberg Media,2025-08-19
b3eaab9f-3711-4c74-ab20-03845acb3123,World Language Education (BSED),program_suspension,2025-08-15,2025,Fall 2025,confirmed,,,,"Program suspended for new students due to low enrollment. Offered teacher licensure in 8 languages: Chinese, French, German, Italian, Japanese, Latin, Russian, Spanish.",3bf6a54c-1dde-48fc-80ac-e3a2f83c504a,Bowling Green State University,Bowling Green,OH,Ohio,Public,https://www.bgsu.edu,,,unmatched,FALSE,0,,,,,,,,,,,,,,,,,,,,,,,,,,,,,,,,,,,,,,,,,,,,,,,,9ae6824d-032e-4da1-95da-76505060fa19,https://www.threads.com/@13abc/post/DNZQKFwK_vm/bowling-green-state-university-will-no-longer-offer-the-world-language-education,"Bowling Green State University will no longer offer the World Language Education major to new students, due to low enrollment",13abc Action News,
b489e06b-9a55-4119-a9f8-7a73ce28371d,Wintersession and Office of Campus Engagement,program_suspension,2025-08-14,2025,September 2025,confirmed,,4,,"Two-week noncredit program discontinued due to budget cuts from federal funding reassessment and economic uncertainty. Office of Campus Engagement also closing. The 2025 edition of Wintersession drew 4,359 attendees, an increase of more than 2,000 from the program’s inaugural year in 2021",7786c231-751a-41ee-a72f-c0b09adc1e0b,Princeton University,Princeton,NJ,New Jersey,Private non-profit,https://www.princeton.edu,,186131,normalized_name_state_fallback,TRUE,3,Princeton University,Private not-for-profit,"Private not-for-profit, 4-year or above",Four or more years,City: Small,"Degree-granting, primarily baccalaureate or above",9042,3.692660550458716,No,2446195000,2468072000,-20.497778967582352,Yes,No,-21877000,Yes,Yes,3,4,17491.42345110087,-22.99816033855218,5.585940613892188,8184,1242,17.501794687724338,5.2542372881355925,0.23811103738111036,0.12623719395728425,0.4343588181541273,-1.6445865692096848,28.460620525059667,0.3630833886308339,0,,0.11084830454156362,-1.1901025914609282,33401865000,,,,,,,,2,112,6140,b6494eca-9644-4212-ac61-a0f701cf0cfd,https://www.dailyprincetonian.com/article/2025/08/princeton-news-adpol-university-discontinues-wintersession-in-wake-of-recent-budget-cuts,"U. discontinues Wintersession, citing budget constraints",The Daily Princetonian,
3fc84917-f3c3-447f-b408-2877edac91b0,Multiple programs including mathematics majors consolidation and medieval studies graduate programs,program_suspension,2025-08-12,2025,Fall 2025,confirmed,,,,"7 programs permanently closed after low-enrollment review, including graduate certificates in global health, obesity prevention, and bachelor's/master's programs in mathematics and medieval studies",813599d7-baaf-40e7-938d-cf7b6e707df1,University of Connecticut,Storrs,CT,Connecticut,Public,uconn.edu,,129020,normalized_name_state_fallback,TRUE,2,University of Connecticut,Public,"Public, 4-year or above",Four or more years,Town: Fringe,"Degree-granting, primarily baccalaureate or above",47445,59.838965064178154,No,3231198767,3278056108,3.2545781086812915,No,No,-46857341,Yes,Yes,3,4,17700.210204892857,-17.72826034504778,15.1590153475693,11395,3077,13.14665872306623,7.137883008356546,0.0763410264516809,0.04336999377464204,0.2192735859664905,-12.406287787182588,40.87903539478802,0.18743808620507957,0.02282902303886115,-13.306426221558084,0.02221573436980707,156.19968747400858,622770599,,,,,,,,42,8057,6446,21bdccfe-ba7d-47a0-9600-e1afc53a521b,https://hartfordbusiness.com/article/uconn-closes-7-academic-programs-after-low-enrollment-review/,UConn closes 7 academic programs after low-enrollment review,Hartford Business Journal,2025-08-12
1ab37118-cfc8-4e77-bcbf-148fbf5cb58d,Iowa Summer Writing Festival,program_suspension,2025-08-12,2025,"December 31, 2025",confirmed,,,,Both Iowa Summer Writing Festival (since 1987) and Iowa Youth Writing Project discontinued simultaneously due to ongoing funding challenges,a63736b5-c8bd-4a0a-9f8c-27c8416c8582,University of Iowa,Iowa City,IA,Iowa,Public,uiowa.edu,,153658,normalized_name_state_fallback,TRUE,2,University of Iowa,Public,"Public, 4-year or above",Four or more years,City: Small,"Degree-granting, primarily baccalaureate or above",32864,-7.003593763264382,Yes,5800272000,5043165000,20.01506723996363,No,No,757107000,No,No,0,0,18368.74051593323,-7.437919121163914,8.139187265700642,11786,2995,9.291543026706233,2.9209621993127146,0.05078505355404089,0.01664505875956672,0.14196358762426003,-47.72940808017538,-57.61808024377857,0.2724257546251217,0.03997171629106842,28.283955851723977,0.1693221017128835,123.66397065051032,3505385000,,,,,,,,42,9261,6441,6d8915d8-34d7-462e-9a11-67b8d7263824,https://littlevillagemag.com/iowa-youth-writing-project-and-iowa-summer-writing-festival-ending/,"UI announces end to Iowa Summer Writing Festival, Iowa Youth Writing Project",Little Village Magazine,2025-08-12
830d339e-6ebc-4b11-8685-69f8cbb5179b,USC Annenberg School for Communication and Journalism,staff_layoff,2025-08-12,2025,,confirmed,,13,,13 employees laid off to help meet $6.5 million budget cut required by USC as part of university-wide deficit reduction efforts exceeding $200 million,2f163a25-ee0d-4dd2-b262-56223e1739bd,University of Southern California,Los Angeles,CA,California,Private non-profit,https://www.usc.edu,123961,123961,collegecuts_institutions.unitid,TRUE,2,University of Southern California,Private not-for-profit,"Private not-for-profit, 4-year or above",Four or more years,City: Large,"Degree-granting, primarily baccalaureate or above",51953,-2.3182792464182302,Yes,8215984000,7619619000,22.682321501020432,No,No,596365000,No,No,1,2,45642.98773217456,-5.687420730978349,20.966593897943326,17359,4025,4.045792375929034,5.228758169934641,0.27059072623332625,0.1487148368081141,0.3679454331417492,11.288790373654212,47.142558090852,0.5559255480915443,0,,0.15917552496879722,28.26811597338058,8092846000,,,,,,,,24,4956,6197,df6ffe6d-2bc6-427b-b31c-80854319bc43,https://www.uscannenbergmedia.com/2025/08/11/annenberg-lays-off-13-employees-to-make-65-million-budget-cut/,Annenberg lays off 13 employees to make $6.5 million budget cut,USC Annenberg Media,2025-08-11
6fc764c3-c473-435e-b5fa-14af66790357,SNAP-Ed / Eat.Move.Save program (Illinois Extension),staff_layoff,2025-08-09,2025,,confirmed,,217,,"Federal funding eliminated for SNAP-Education program, affecting over 200 Extension jobs and 1 million Illinois residents served",3189fae5-8a4c-4d43-99c0-5d4125f62d3e,University of Illinois Urbana-Champaign,Champaign,IL,Illinois,Public,https://illinois.edu,,145637,normalized_name_state_fallback,TRUE,1,University of Illinois Urbana-Champaign,Public,"Public, 4-year or above",Four or more years,City: Small,"Degree-granting, primarily baccalaureate or above",62797,14.207511139401657,No,3348027322,3113616210,-4.180202142249705,Yes,No,234411112,No,No,0,1,16670.956262425447,-11.885388717584064,28.552514124315746,13499,3014,12.472921179803366,12.9261895841139,0.21894358010733,0.14884701612042275,0.32263413478621344,13.253706754530478,32.90478492025133,0.4033472936605252,0.03918585504800005,7.351561076256181,0.01410863480052222,-40.40235560264336,2606081833,,,,,,,,27,9736,5882,98ed8ea8-8eaa-4d3e-aa12-8b5b7c4e4a36,https://www.wandtv.com/news/illinois/hundreds-of-illinois-extension-jobs-lost-after-federal-funding-cuts/article_c491d090-b357-4c42-b2ef-f8737bb11475.html,Hundreds of Illinois Extension jobs lost after federal funding cuts,WANDTV,2025-08-09
7c9ead5e-3a63-4534-80df-1c03b997f430,36 staff positions eliminated,staff_layoff,2025-08-08,2025,,confirmed,,36,,"23 employees laid off, 13 unfilled positions cut, 10 employees hours reduced. Part of $17.5M budget reduction due to state funding cuts and declining enrollment.",3a530771-07e5-4940-b8bb-cfb90a1a06b1,University of New Hampshire,Durham,NH,New Hampshire,Public,https://www.unh.edu,183044,183044,collegecuts_institutions.unitid,TRUE,3,University of New Hampshire-Main Campus,Public,"Public, 4-year or above",Four or more years,Town: Fringe,"Degree-granting, primarily baccalaureate or above",14676,-11.977448569543574,Yes,747378839,677515727,-2.803012824138789,Yes,No,69863112,No,No,0,0,13445.86743557924,-22.32108836438205,24.64545801784468,3650,945,-4.174323969545812,-5.31062124248497,0.03331970564186427,0.01064449064449064,0.13617502829121086,-44.620611551528874,-5.961538461538462,0.18063505042245845,0.10167627754070738,23.62052491128844,0.11597992949067036,120.32617090278026,525445726,,,,,,,,57,6449,6539,f41aab87-86be-43a7-be33-688fd381ad3e,https://www.nhpr.org/nh-news/2025-08-08/university-new-hampshire-unh-to-cut-36-positions-chilton-says,"University of New Hampshire to lay off 23 employees, cut 13 unfilled positions",NHPR,2025-08-08
cda5fb31-6e3b-46e3-8f73-23362f9e92c6,Retirement and Disability Research Center,department_closure,2025-08-08,2025,August 2025,confirmed,,,,"Closure due to Social Security Administration funding cuts affecting retirement research centers at 6 institutions, part of $15M in terminated research funding",11728dd7-4f13-4cef-af4e-02980b51297a,University of Wisconsin-Madison,Madison,WI,Wisconsin,Public,www.wisc.edu,,240444,normalized_name_state_fallback,TRUE,0,University of Wisconsin-Madison,Public,"Public, 4-year or above",Four or more years,City: Large,"Degree-granting, primarily baccalaureate or above",53774,13.466407832545576,No,4541903107,4227555880,17.88615283090425,No,No,314347227,No,No,0,2,20828.34246191887,-6.369290586182339,19.65894454295764,21346,5218,14.125320786997433,10.41049513330512,0.16459627329192547,0.1175921487499054,0.29638537171960105,19.964760097587423,48.357358364063025,0.26289656711421877,0.0951984966927642,10.597928380042209,0.02965259273088552,67.37456651313067,6101887051,,,,,,,,20,7498,6248,b2c70d98-fd88-4b6a-b0c3-e4fdcef2c86d,https://www.plansponsor.com/university-of-wisconsins-retirement-research-center-closes/,University of Wisconsin's Retirement Research Center Closes,Plan Sponsor,
