d4b9b12e-0881-49f5-b53c-de5064eae92b,"Division of Diversity, Equity & Educational Achievement",department_closure,2025-07-09,2025,,confirmed,,10,,DEI division sunset announced 2025-07-09. Programs relocated to Teaching & Learning division. <10 staff laid off. Scholarships and student support programs continue under new structure.,d5130bd5-841f-4859-bbae-17a4621f9dc8,University of Wisconsin–Madison,Madison,WI,Wisconsin,Public,https://www.wisc.edu,,240444,normalized_name_state_fallback,TRUE,0,University of Wisconsin-Madison,Public,"Public, 4-year or above",Four or more years,City: Large,"Degree-granting, primarily baccalaureate or above",53774,13.466407832545576,No,4541903107,4227555880,17.88615283090425,No,No,314347227,No,No,0,2,20828.34246191887,-6.369290586182339,19.65894454295764,21346,5218,14.125320786997433,10.41049513330512,0.16459627329192547,0.1175921487499054,0.29638537171960105,19.964760097587423,48.357358364063025,0.26289656711421877,0.0951984966927642,10.597928380042209,0.02965259273088552,67.37456651313067,6101887051,,,,,,,,20,7498,6248,6109aee7-8512-4851-9aeb-3279103cec9c,https://www.fox6now.com/news/uw-madison-dei-division-close-move-programs-other-divisions,UW-Madison DEI division to close; move programs to other divisions,Fox6 Milwaukee,2025-07-09
41a4ed38-f6ad-4d62-bc3c-c46a25bbc3f9,Staff layoff amid budget challenges,staff_layoff,2025-07-07,2025,,confirmed,,120,,"Announced 120 staff layoffs and elimination of 120 vacant positions due to 5% budget cuts, citing federal funding uncertainty and operational challenges.",2ea61637-f1f9-4d88-9375-4f305a8d2d58,Boston University,Boston,MA,Massachusetts,Private non-profit,https://www.bu.edu,164988,164988,collegecuts_institutions.unitid,TRUE,1,Boston University,Private not-for-profit,"Private not-for-profit, 4-year or above",Four or more years,City: Large,"Degree-granting, primarily baccalaureate or above",45380,6.080086023516211,Yes,2842523000,2537997000,2.8537991620497105,No,No,304526000,No,No,1,1,38419.96659967732,-11.669090661631191,47.75120553114258,11532,4381,9.65104117143672,9.634634634634637,0.28052005288673426,0.2150857542877144,0.3469188421239567,20.78944871429927,57.14109369213677,0.4963420008814456,0,,0.14481742473275533,3.436504478717705,3528624000,,,,,,,,23,4276,5428,3ddc4ae1-dc66-4f31-a03b-2d905d11e688,https://www.highereddive.com/news/boston-university-staff-layoffs-120-budget-federal-funding/752499/,Boston University to lay off 120 staffers amid budget challenges,Higher Ed Dive,
390e19fb-1437-4a94-9c79-9f8eebbca5fe,"Programs affected include a Master of Arts in Political Science, an associate degree in Chemical Technology, and multiple degrees in German and Visual Arts.",program_suspension,2025-07-05,2025,Fall 2025,confirmed,,,,Part of 51 program modifications due to Indiana state mandate requiring low-enrollment program reductions. Includes suspension/elimination of 9 programs with teach-out plans for current students.,c1001ec9-cd4d-429f-92ad-4556e6c40a87,Ball State University,Muncie,IN,Indiana,Public,https://www.bsu.edu,150136,150136,collegecuts_institutions.unitid,TRUE,3,Ball State University,Public,"Public, 4-year or above",Four or more years,City: Small,"Degree-granting, primarily baccalaureate or above",23638,-6.1946902654867255,Yes,571804612,487764680,-14.337227240849964,Yes,No,84039932,No,No,0,0,8890.423330723632,-16.830478514033814,27.80294993493337,3429,1297,-6.972327726532828,-0.5368098159509203,0.0147643624672138,0.00611658968917738,0.03295693277310924,-25.902335456475583,-66.50671785028791,0.3221930789406887,0.01188948517623436,-70.29938986325728,0.04666313651102995,14.051333565519576,260813964,,,,,,,,43,6339,6260,169d105f-fa19-48f5-bcf7-c29ea92cf006,https://www.ballstatedaily.com/article/2025/07/ball-state-adjusts-51-degree-programs-amid-statewide-enrollment-mandate-daily-news,Ball State adjusts 51 degree programs amid statewide enrollment mandate,The Ball State Daily News,2025-07-05
151a6702-06e9-459d-8cfe-9fb2da8a015e,Administrative Staff Reductions,staff_layoff,2025-07-04,2025,,confirmed,,75,,75 positions eliminated through 5% administrative expense reduction to save $20M. Includes Office of Sustainability closure (3 jobs) and Health Science Center PST program (15 positions).,4f87591c-9d5e-4957-8116-067dbc09037c,University of Florida,Gainesville,FL,Florida,Public,ufl.edu,,134130,normalized_name_state_fallback,TRUE,0,University of Florida,Public,"Public, 4-year or above",Four or more years,City: Midsize,"Degree-granting, primarily baccalaureate or above",61936,5.424773187628726,No,5826120000,5197949000,40.32147914685729,No,No,628171000,No,No,1,1,9213.408973697782,-7.1306534798887835,7.665822193844274,17391,3587,8.625858838226108,5.90493061706525,0.09117476104365796,0.02891805679025257,0.1916842549598987,11.91042409829568,8.346124328472754,0.38249160423663137,0.1147979017990351,-55.97524784384509,0.08997986896993433,277.15331896858817,2448293000,,,,,,,,11,3734,6226,91214a46-4b2b-4dab-bb22-3d9a7a759f63,https://www.alligator.org/article/2025/08/uf-shuts-down-office-of-sustainability,UF shuts down Office of Sustainability,The Independent Florida Alligator,2025-08-05
8b66837c-5cb2-4a95-8929-cf2a79e4a9d9,"Liberal Arts programs (Political Science, Communications majors; Art, Music minors; Environmental Science concentration)",program_suspension,2025-07-02,2025,Fall 2025,confirmed,,,,Cuts address $6M deficit from alleged endowment mismanagement. University maintains introductory liberal arts courses but eliminates upper-level programs to reallocate resources.,33a916f0-8873-41f7-a9f0-6bb6aa2d0e9b,Averett University,Danville,VA,Virginia,Private non-profit,https://www.averett.edu,231420,231420,collegecuts_institutions.unitid,TRUE,2,Averett University,Private not-for-profit,"Private not-for-profit, 4-year or above",Four or more years,Town: Distant,"Degree-granting, primarily baccalaureate or above",1762,76.37637637637637,No,32561742,40960483,0.3080733289801352,No,No,-8398741,Yes,Yes,3,4,13408.097094801224,-31.62754903790075,53.86011288953767,361,156,42.68774703557312,75.28089887640449,0.06356413166855845,0.07837648705388384,0,93.10344827586206,67.16417910447761,0.18898978433598185,0,,0,-100,5687825,,,,,,,,63,747,7132,e4b9aa81-ee26-48cb-bab4-bbf0869badbe,https://wset.com/news/local/averett-university-cuts-liberal-arts-programs-amid-financial-crisis-thomas-powell-president-july-2025,Averett University cuts liberal arts programs amid financial crisis,WSET,2025-07-02
6cd4d8c0-6b93-45dd-b471-54a42644fc2d,"B.A. in French, B.A. in Art History, B.A. in Italian, M.A. in Japanese, M.A. in Theater and Drama, M.A. in Chinese",program_suspension,2025-07-01,2025,Fall 2025,confirmed,,,,Eliminated as part of 116 degree program cuts at IU Bloomington due to state-mandated graduation thresholds (minimum 15 graduates annually for bachelor degrees).,c249bfd1-dbd4-4fdd-b68d-28caa87d8a40,Indiana University Bloomington,Bloomington,IN,Indiana,Public,https://bloomington.iu.edu,151351,151351,collegecuts_institutions.unitid,TRUE,2,Indiana University-Bloomington,Public,"Public, 4-year or above",Four or more years,City: Small,"Degree-granting, primarily baccalaureate or above",62701,35.064515434159794,No,2090518827,2130537776,2.183607189776045,No,No,-40018949,Yes,Yes,4,5,20114.724093780827,-11.652468330848604,45.841529271240574,9598,2600,2.041250265787795,4.543626859670286,0.0890575907880257,0.03882348308855377,0.30335097001763667,-9.87734021949645,-18.26697892271663,0.18990127749158703,0.01528064602621719,-23.603957645231713,0.08267210965738092,58.518096178276224,2087993958,,,,,,,,27,9926,5947,230121ca-6f2c-4286-843e-ce2e5e8e7cb6,https://www.idsnews.com/article/2025/07/indiana-higher-education-degrees-eliminated-suspended,"Over 400 Indiana higher education degrees eliminated, suspended",Indiana Daily Student,2025-07-01
56709c63-5e4d-4a93-9782-2c9aca6b57f5,"Bachelor's in Microbiology, Bachelor’s in Mathematics, Bachelor’s in Design and Production, Master’s in Health Sciences",program_suspension,2025-07-01,2025,Fall 2026,confirmed,,,,Suspended with teach-out toward elimination due to low enrollment under Indiana's new degree program thresholds requiring 15+ annual graduates for bachelor's degrees.,670dfee7-fba5-429a-bf6e-7a54b0a34e48,Purdue University,West Lafayette,IN,Indiana,Public,https://www.purdue.edu/,243780,243780,collegecuts_institutions.unitid,TRUE,0,Purdue University-Main Campus,Public,"Public, 4-year or above",Four or more years,City: Small,"Degree-granting, primarily baccalaureate or above",57417,21.10225259427993,No,3103287662,2516129650,14.311267170855022,No,No,587158012,No,No,0,0,19108.361266107346,-11.381089220471472,30.677683756408396,12999,2546,12.070006035003017,4.730563554092966,0.17576675897382307,0.1012282138261785,0.3929252998909488,6.838873597289859,6.624405705229794,0.2555340752738736,0.07006297687341351,48.23032660309295,0.13292641072538336,77.84613092473715,3971950988,,,,,,,,22,8949,6136,c78467be-d48b-4ccf-9f88-fa8897e2ae12,https://www.basedinlafayette.com/p/heres-what-purdue-degree-programs,Here's what Purdue degree programs are going away to satisfy new state law,Based in Lafayette,
d6fd691c-552b-4e46-a3f7-6180ee6928e9,Staffing reductions,staff_layoff,2025-06-30,2025,,confirmed,,202,,"Statewide layoffs impacting 5.3% of full-time staff across 45 campuses due to $2.4B state funding cuts. Tuition frozen through 2026-2027 at $2,577/semester.",bce738de-fd42-40bc-b83b-931dcbda0351,Ivy Tech Community College,Indianapolis,IN,Indiana,Public,https://www.ivytech.edu,150987,150987,collegecuts_institutions.unitid,FALSE,0,,,,,,,,,,,,,,,,,,,,,,,,,,,,,,,,,,,,,,,,,,,,,,,,2ba58db8-3a28-4e9a-a1f4-3b246ff0b2f4,https://www.therepublic.com/2025/06/02/ivy-tech-will-lay-off-202-employees-statewide-including-14-in-columbus-due-to-state-funding-cuts/,"Ivy Tech will lay off 202 employees statewide, including 14 in Columbus due to state funding cuts",The Republic,2025-06-02
79602a45-bd21-4aac-95d6-5644f5aae297,Institution closure,institution_closure,2025-06-30,2025,End of 2026 Academic Year,confirmed,2300,,,Closure due to financial instability from declining enrollment (33% drop over a decade) and rising operational costs.,3f85957e-5db6-48c7-a2ee-470874d19528,Siena Heights University,Adrian,MI,Michigan,Private non-profit,https://www.sienaheights.edu,172264,172264,collegecuts_institutions.unitid,TRUE,5,Siena Heights University,Private not-for-profit,"Private not-for-profit, 4-year or above",Four or more years,Town: Distant,"Degree-granting, primarily baccalaureate or above",2192,-26.566164154103856,Yes,35737922,37745621,-26.00350753374061,Yes,No,-2007699,Yes,Yes,3,3,8258.406351263771,-40.8096142003856,35.65602107475639,337,142,-20.14218009478673,-28.999999999999996,0.03239051094890511,0.03296703296703297,0.02631578947368421,61.36363636363637,545.4545454545454,0.08667883211678833,0,,0.17455409366150107,-19.96042539352218,14838766,,,,,,,,68,1166,7226,4b7c7e0b-36aa-40ad-8cda-a414e96ff80c,https://universitybusiness.com/tracking-college-closings-in-higher-ed-2025/,Tracking college closings in higher ed 2025,University Business,
aa83188d-211d-47ac-acb2-fd1279eafb40,UCLA Extension Staff Positions,staff_layoff,2025-06-30,2025,Summer 2025,confirmed,,23,,Layoffs due to federal budget cuts targeting continuing education programs.,9a4ff3e1-4807-4d26-b71f-9b41a2e02960,"University of California, Los Angeles",Los Angeles,CA,California,Public,https://www.ucla.edu,110662,110662,collegecuts_institutions.unitid,TRUE,1,University of California-Los Angeles,Public,"Public, 4-year or above",Four or more years,City: Large,"Degree-granting, primarily baccalaureate or above",49388,4.851071057045199,No,12676004000,11701713120,21.010802346386377,No,No,974290880,No,Yes,4,8,21307.958775308216,-17.284478009840036,7.812635590837617,30136,5628,14.88258615431534,8.314087759815243,0.13606544099781323,0.07837590719469684,0.2763724808895066,-8.980089394555058,8.82591093117409,0.29136632380335303,0.05870845734313877,12.976038752608954,0.03916187959177891,96.08935665579604,3529545000,,,,,,,,19,6202,5715,ee6f1d8a-28dd-4364-a24d-153ead1148d9,https://dailybruin.com/2025/07/21/ucla-extension-lays-off-employees-eliminates-positions-amid-federal-budget-cuts,"UCLA Extension lays off employees, eliminates positions amid federal budget cuts",Daily Bruin,2025-07-21
749a7554-61e9-41b6-8886-fa69c97a97e7,Deficit reduction: 20 positions eliminated (16 occupied),staff_layoff,2025-06-26,2025,,confirmed,,16,,Part of effort to close $23 M shortfall; earlier 2025 cuts preceded this.,5ef51e16-1ce4-4804-b551-ede44d3f0ed9,Western Washington University,Bellingham,WA,Washington,Public,https://www.wwu.edu,237011,237011,collegecuts_institutions.unitid,TRUE,2,Western Washington University,Public,"Public, 4-year or above",Four or more years,City: Small,"Degree-granting, primarily baccalaureate or above",16137,-10.180340643437605,Yes,429108942,385468361,4.370139554318898,No,No,43640581,No,No,1,3,9108.924981017464,-7.4081222015414605,27.95666327549986,2192,968,-0.408905043162199,-1.1235955056179776,0.0131375100700254,0.01210830949371299,0.02712477396021699,-6.607929515418502,12.76595744680851,0.06853814215777405,0.01913427799885917,9.193900961234627,0.01575615022373128,48.16713548652596,125985155,,,,,,,,29,4003,5951,27ec7b27-e0b4-4347-afe4-76bc526d838f,https://mybellinghamnow.com/news/297792-more-layoffs-hit-staff-at-western-washington-university-amidst-23-million-budget-deficit/,Western Washington University cuts 20 positions to shrink $23 M deficit,My Bellingham Now,2025-06-26
c9144208-32f4-45bf-83e3-d8334be60a64,University-wide staff reductions (8 departments),staff_layoff,2025-06-25,2025,,confirmed,,60,,"60 positions eliminated across HR, marketing and other units; no faculty affected.",5ec2fb43-0687-4258-a1ff-5568a4e8dd79,Southern New Hampshire University,Manchester,NH,New Hampshire,Private non-profit,https://www.snhu.edu,183026,183026,collegecuts_institutions.unitid,TRUE,0,Southern New Hampshire University,Private not-for-profit,"Private not-for-profit, 4-year or above",Four or more years,Suburb: Midsize,"Degree-granting, primarily baccalaureate or above",255134,65.79739152472983,No,1480231395,1291311307,42.87344748890842,No,No,188920088,No,No,0,0,11016.64410177835,-10.021949645960946,91.31816840028584,14914,9887,54.854116914131446,58.040281329923275,0.0072863671639217,0.00577966557139018,0.01471716537629908,129.22318125770653,37.601776461880085,0.1685820000470341,0,,0.00686484674759594,263.07851072266754,64647512,,,,,,,,58,92934,7181,cba715ee-908b-4550-91ed-e17151576a43,https://www.wmur.com/article/snhu-southern-new-hampshire-university-job-cuts/65227741,SNHU eliminates 60 positions across eight departments,WMUR-TV,2025-06-25
13dfd831-8f29-4dfe-a528-751acc397e5a,Budget shortfall: 10 staff layoffs,staff_layoff,2025-06-25,2025,,confirmed,,10,,Additional measures include salary freezes and admin pay cuts.,c02928f5-2c9f-49b5-805e-eba48f0c6787,Whitman College,Walla Walla,WA,Washington,Private non-profit,https://www.whitman.edu,237057,237057,collegecuts_institutions.unitid,TRUE,1,Whitman College,Private not-for-profit,"Private not-for-profit, 4-year or above",Four or more years,City: Small,"Degree-granting, primarily baccalaureate or above",1598,-0.43613707165109034,No,185518231,107319099,52.39693159072797,No,No,78199132,No,No,1,2,29630.727513227514,-22.285111162018065,24.149464857715248,564,230,-8.589951377633712,-12.547528517110266,0.1376720901126408,0.1376720901126408,,81.81818181818183,279.3103448275862,,0,,0.01474304031154783,86.35594451230833,785977679,,,,,,,,54,827,5726,4f0d4b1e-a51a-4cd3-b4bd-ce71662b0615,https://www.nwpb.org/2025/06/25/whitman-college-lays-off-10-staffers-citing-3-million-budget-shortfall/,Whitman College lays off 10 staffers amid $3 M shortfall,Northwest Public Broadcasting,2025-06-25
b93d7df1-2d44-4b40-bdcd-ef5788a1ecd6,Academic restructure: up to 30 % faculty & 5 % staff cuts,staff_layoff,2025-06-20,2025,,confirmed,,99,,Estimated ~99 faculty layoffs if 30 % target is reached.,73f9e84d-7089-4cbe-bc9c-8dda7ae8f0f2,Clark University,Worcester,MA,Massachusetts,Private non-profit,https://www.clarku.edu,165334,165334,collegecuts_institutions.unitid,TRUE,1,Clark University,Private not-for-profit,"Private not-for-profit, 4-year or above",Four or more years,City: Midsize,"Degree-granting, primarily baccalaureate or above",4611,32.76706017852001,No,205695000,162136000,66.21065616444724,No,No,43559000,No,Yes,3,5,23937.34542456719,-4.161567704131892,42.348136804492086,924,421,6.944444444444445,7.672634271099745,0.3838646714378659,0.0551500405515004,0.7617715617715618,109.71563981042654,102.05479452054796,0.4651919323357189,0,,0.0114865304176329,-35.7216092781613,486846000,,,,,,,,58,1368,6455,4c729b02-3da7-4021-9bbd-9f3871ed0160,https://www.masslive.com/news/2025/06/clark-university-to-lay-off-30-of-faculty-amid-enrollment-woes.html,"Clark University to cut up to 30 % of faculty, 5 % of staff",MassLive,2025-06-20
8323184f-e02e-4c7b-a8f8-7a9080109eb4,"Programs across colleges (7% cut), 350 positions eliminated",staff_layoff,2025-06-20,2025,Fall 2025,confirmed,,350,,UMN is cutting 7% of program budgets and eliminating 350 positions to cover a $115M revenue gap.,4904cd6a-cc07-40a0-8800-09724f6e464b,University of Minnesota,Minneapolis,MN,Minnesota,Public,https://twin-cities.umn.edu,174066,174066,collegecuts_institutions.unitid,TRUE,2,University of Minnesota-Twin Cities,Public,"Public, 4-year or above",Four or more years,City: Large,"Degree-granting, primarily baccalaureate or above",59339,-3.9619984786443743,Yes,4329939840,4104955674,1.0621076651095749,No,No,224984166,No,No,0,2,16926.773237800156,-13.268259077747288,16.149851541586315,20210,5291,6.609695626945192,6.373140329714516,0.09474376042737492,0.04921553978333956,0.21287938450354396,-16.001792917974004,-18.32049978207177,0.27818129729183166,0.14029051172099374,5.475061969290162,0.05633438680951012,26.52648862736784,5512426113,,,,,,,,28,11193,6217,7fcbcd73-c919-4567-a6c2-5763d0362fab,https://www.chronicle.com/article/u-of-minnesota-tries-to-soften-the-blow-of-tuition-hikes-budget-cuts-with-faculty-benefits,University of Minnesota Approves Major Budget Cuts for 2025,University of Minnesota,2025-06-20
46a33afd-6137-4b74-a873-b0fa994c5a31,Institution workforce reduction,staff_layoff,2025-06-20,2025,,confirmed,,650,,"650 layoffs (2% of workforce) primarily impacting research, administration, and support roles due to federal budget reductions and $300M operational cuts",2168a70d-1cce-4da8-a07c-66de90cf7fc3,Vanderbilt University Medical Center,Nashville,TN,Tennessee,Private non-profit,https://www.vumc.org,221999,221999,collegecuts_institutions.unitid,TRUE,1,Vanderbilt University,Private not-for-profit,"Private not-for-profit, 4-year or above",Four or more years,City: Large,"Degree-granting, primarily baccalaureate or above",14360,5.3249229866510195,No,2360303618,1685508835,14.693259073319414,No,No,674794783,No,Yes,3,4,34879.843256593456,-4.801138244734989,16.753471035860606,7170,1602,14.738358137301969,1.7789072426937738,0.12534818941504178,0.10171585449553878,0.14968197879858658,22.866894197952217,42.29249011857708,0.49268802228412256,0,,0.13492557843826714,5.310695587610775,10247727490,,,,,,,,10,684,6117,491895f1-29e2-414a-8c36-2d8f84d06e60,https://www.fiercehealthcare.com/providers/vanderbilt-university-medical-center-announces-650-layoffs-300m-budget-cut,"Vanderbilt University Medical Center announces 650 layoffs, $300M-plus budget cut",FierceHealthcare,2025-06-20
3b066871-7d44-43c7-b20e-02c6f0acdde4,"Multiple low-enrollment degree programs (TBA, system-wide)",department_closure,2025-06-19,2025,Fall 2025,confirmed,,,,Regents-approved FY25 budget directs campuses to retire low-productivity majors; specific lists due July.,45feebdc-cc8a-4fdb-9b18-d780c5ce30b0,University of Minnesota System,Minneapolis,MN,Minnesota,Public,https://umn.edu,174066,174066,collegecuts_institutions.unitid,TRUE,2,University of Minnesota-Twin Cities,Public,"Public, 4-year or above",Four or more years,City: Large,"Degree-granting, primarily baccalaureate or above",59339,-3.9619984786443743,Yes,4329939840,4104955674,1.0621076651095749,No,No,224984166,No,No,0,2,16926.773237800156,-13.268259077747288,16.149851541586315,20210,5291,6.609695626945192,6.373140329714516,0.09474376042737492,0.04921553978333956,0.21287938450354396,-16.001792917974004,-18.32049978207177,0.27818129729183166,0.14029051172099374,5.475061969290162,0.05633438680951012,26.52648862736784,5512426113,,,,,,,,28,11193,6217,c41b3d61-d05f-473b-a778-86e15efc5c76,https://www.startribune.com/university-of-minnesota-proposes-7-budget-cuts-and-largest-tuition-hike-in-more-than-a-decade/601367825,"U of M Regents OK budget, warn of program cuts amid $42M shortfall",Star Tribune,2025-06-19
cb2cc901-49c4-4179-9338-3cd506bddc1b,Budget cuts: 42 positions terminated (11 faculty),staff_layoff,2025-06-19,2025,,confirmed,,42,,Part of plan to close $25.7 M deficit; more layoffs expected.,fe8a42e3-81ab-4a2e-a372-780647e26620,University of Oregon,Eugene,OR,Oregon,Public,https://www.uoregon.edu,209551,209551,collegecuts_institutions.unitid,TRUE,0,University of Oregon,Public,"Public, 4-year or above",Four or more years,City: Midsize,"Degree-granting, primarily baccalaureate or above",25432,0.9086219894457008,No,1444279032,1317915991,5.991606524946789,No,No,126363041,No,No,1,3,20939.28005384788,-2.354579832227868,32.308982243813396,5740,1470,10.405847278322751,5.0750536097212295,0.03625353884869456,0.01724705108322759,0.13363833373464964,-66.26417855836078,-74.64246424642465,0.1632982069833281,0.02862110034973796,19.312876285885796,0.03957072132204225,25.784084072739628,1613595472,,,,,,,,29,5847,6351,6b878012-0063-4697-bd46-2ecfa77b6caf,https://lookouteugene-springfield.com/story/education/2025/06/19/42-uo-college-of-arts-and-sciences-staff-and-faculty-get-layoff-notices/,University of Oregon lays off 42 employees amid $25.7 M deficit,Lookout Eugene-Springfield,2025-06-19
5af0a66a-4bda-4600-9e68-27968958eea0,Layoff of 20 full-time faculty (18 tenured),staff_layoff,2025-06-18,2025,,confirmed,,20,,"Another round of cuts amid $40 M deficit; enrollment down to 5,570.",3c8eb376-964a-479d-8bdf-98f95cea54f2,Columbia College Chicago,Chicago,IL,Illinois,Private non-profit,https://www.colum.edu,144281,144281,collegecuts_institutions.unitid,TRUE,5,Columbia College Chicago,Private not-for-profit,"Private not-for-profit, 4-year or above",Four or more years,City: Large,"Degree-granting, primarily baccalaureate or above",6888,-8.221185876082611,Yes,169594198,184954163,-22.934596269732054,Yes,No,-15359965,Yes,Yes,3,5,17134.40202254642,-35.77229212997857,60.94236372402315,1036,619,-30.8411214953271,-28.190255220417633,0.04965156794425087,0.04125412541254125,0.30180180180180183,-18.181818181818183,41.90871369294606,0.03222996515679442,0,,0.00770020355999243,-32.749055204689206,191973543,,,,,,,,56,3523,6617,b2d0bbde-0a85-47e7-a9f5-ff8cad37211b,https://chicago.suntimes.com/news/2025/06/18/columbia-college-layoff,Columbia College Chicago lays off 20 full-time faculty,Chicago Sun-Times,2025-06-18
e1978915-5efc-4823-9374-e32e137772ac,Track and Field,program_suspension,2025-06-17,2025,Fall 2025,confirmed,,,,"Elimination of all field events (jumps/throws) and reduction of sprints/hurdles, shifting to distance-focused program while honoring current scholarships.",b9891778-6b70-4e67-ba7d-a9e03ac25dcb,Washington State University,Pullman,DC,District of Columbia,Public,https://wsu.edu,236939,236939,collegecuts_institutions.unitid,TRUE,3,Washington State University,Public,"Public, 4-year or above",Four or more years,Town: Distant,"Degree-granting, primarily baccalaureate or above",29708,-15.47981450396882,Yes,1483854712,1343488998,-4.284544723812724,Yes,No,140365714,No,No,0,3,12300.32935871309,-5.950389935676497,19.117942862319797,6892,1814,2.7429934406678593,-1.6802168021680215,0.05732462636326915,0.03259661686627978,0.1683607466272408,-37.15867158671587,-27.900084674005083,0.18213949104618285,0.03576794702025951,9.162157421403275,0.09471597830325368,55.696517057224746,1383078164,,,,,,,,30,6644,6492,bf38ae70-58c9-4e5d-8a32-f76fa0138236,https://www.si.com/college/washington-state/athletics/washington-state-athletics-announces-significant-cuts-to-track-field-program,Washington State Athletics Announces Significant Cuts To Track & Field Program,Sports Illustrated,2025-06-17
3d332b65-e322-404d-8f2b-a982d7939e8e,Department of Anthropology & Physics,department_closure,2025-06-15,2025,Fall 2025,confirmed,,,,Retrenchment report recommends dissolving Anthropology department; teach-out plan pending grievance.,e4f73e1a-76af-4a4d-a45e-362dfd991529,University of Akron,Akron,OH,Ohio,Public,https://www.uakron.edu,200800,200800,collegecuts_institutions.unitid,TRUE,5,University of Akron Main Campus,Public,"Public, 4-year or above",Four or more years,City: Midsize,"Degree-granting, primarily baccalaureate or above",15195,-28.5277516462841,Yes,315127930,344146361,-34.89687543634395,Yes,No,-29018431,Yes,Yes,3,4,9658.649435190504,-18.108693209086617,32.01691833535669,2315,1013,-18.284504059301092,-20.486656200941916,0.04139519578808819,0.02013581806696146,0.14776768075859345,-41.10486891385768,-58.9960886571056,0.1665679499835472,0.03749687629180633,4.507725726496707,0.08552332997886926,88.21626516317002,351635016,,,,,,,,32,3710,6456,b3a0b621-737d-416d-b18c-cc2b74fdb46a,https://signalakron.org/faculty-voluntarily-leaving-university-of-akron-may-stave-off-staff-cuts-report-says/,"Anthropology and physics professors should be kept, even if programs are eliminated",Signal Akron,2025-06-15
