177065,Columbia College,Missouri,HLC,adverse_action; other,"Approved the institution’s Provisional Plan for the teach out of two additional locations: Columbia College-Crystal Lake, 446 N. Route 31, Crystal Lake, IL 60012 Columbia College-Lake County, 1225 Tri-State Parkway, Gurnee, IL 60031 Missouri Valley College, Marshall, MO; Approved the institution’s Provisional Plan for the teach out of two additional locations: Orlando, 2600 Technology Dr #100, Orlando, FL 32804 Waynesville, Townfield Plaza, 320 Ichord Avenue, Suite A, Waynesville, MO 65583.; Approved the institution’s provisional plan to teach out students at two additional locations: Rolla, 550 Blues Lake Parkway, Rolla, MO 65401 Jefferson City, 3314 Emerald Lane, Jefferson City, MO 65109; Approved the institution’s request to offer the Bachelor of Arts and Bachelor of Science in Cybersecurity (120 credit hours, CIP code 11.1003).; Approved the institution’s request to offer the Master of Public Administration (36 credit hours, CIP code 44.0401).; Approved the institution’s request to offer the Master of Science in Athletics Administration (30 credit hours, CIP code 31.0504).; Approved the institution’s request to offer the Master of Science in Cybersecurity (30 credit hours, CIP code 11.1003).; Approved the institution’s request to offer the Master of Science in Management Information Systems (30 credit hours, CIP Code 11.0401).; Approved the institution’s teach-out plan for closing six additional locations: Jacksonville, 7077 Bonneval Rd #114 , Jacksonville, FL 32216-4050 Mesquite, 3737 Motley Drive, Mesquite, TX 75150 JFTB Los Alamitos, 11206 Lexington Avenue, Suite 110, Los Alamitos, CA 90720 NSB Kings Bay, 918 USS James Madison Rd, Kings Bay, GA 31547-2533 Kansas City, 4240 Blue Ridge Blvd., Suite 400, Kansas City, MO 64133-1702 Springfield, 3271 East Battlefield Road, Suite 250, Springfield, MO 65804; Approved the institution’s teach out of an additional location: Salt Lake City, 5250 South Commerce Dr #300, Murray, UT 84107.",adverse_action; other,FALSE,FALSE,TRUE,10,2025-02-01,2025,Columbia College,2024,Private not-for-profit,"Private not-for-profit, 4-year or above",Four or more years,City: Midsize,"Degree-granting, primarily baccalaureate or above",Missouri,Columbia,-50.00575043128235,-46.37640550821413,Yes,Yes,No,Yes,Yes,Yes,6,-20.08815185514812,66.50428841834668,0,0.01363870672268702,0.03473659995399126,-39.168665067945646,78.09567475136171,-23.143591853150525,0.8262568595135334,0.05438602496792193
173328,Concordia University-Saint Paul,Minnesota,HLC,adverse_action; other,"Approved the institution’s provisional plan to teach out students at an additional location: Barnes Road Site, 9600 SW Barnes Road, Suite 300, Portland, Oregon 97225.; Approved the institution’s request to offer the Bachelor of Applied Science in Sport Management in a reduced-credit format (90 credit hours, CIP code 31.0504).; Approved the institution’s request to offer the Bachelor of Arts in Exercise Science in a reduced-credit format (90 credit hours, CIP code 31.0505).; Approved the institution’s request to offer the Master of Science in Physician Assistant Studies (113 credit hours, CIP code 51.0912).; Approved the institution’s request to open an additional location: Greenwood Village Campus, 660 Greenwood Plaza Blvd, Greenwood Village, CO 80111.",adverse_action; other,FALSE,FALSE,TRUE,5,2026-01-01,2026,Concordia University-Saint Paul,2024,Private not-for-profit,"Private not-for-profit, 4-year or above",Four or more years,City: Large,"Degree-granting, primarily baccalaureate or above",Minnesota,Saint Paul,17.56756756756757,27.11067617675769,No,No,No,No,No,No,1,-3.5488188834503123,76.20381378078213,0,0.00449644295911915,0.13457316285677387,29.06764168190128,-0.30067930420847155,22.313376842747022,0.5224362787064846,0.12691271468839013
177214,Drury University,Missouri,HLC,adverse_action; other,"Approved the institution’s provisional plan to teach out students at the branch campus: Rolla, 1034 South Bishop Avenue, Rolla, MO 65401.; Approved the institution’s request to offer the following programs: Bachelor of Science in Mechanical Engineering (129 semester credit hours, CIP code 14.1901). Bachelor of Science in Electrical Engineering (129 semester credit hours, CIP code 14.1001).",adverse_action; other,FALSE,FALSE,TRUE,2,2025-02-01,2025,Drury University,2024,Private not-for-profit,"Private not-for-profit, 4-year or above",Four or more years,City: Midsize,"Degree-granting, primarily baccalaureate or above",Missouri,Springfield,-12.678207739307537,0.463477268752246,No,Yes,No,Yes,Yes,Yes,8,-21.221763809640446,34.66652694797135,0,0.01720327495057378,0.08338192419825073,1.2376237623762376,27.865402770547615,-28.382232835409095,0.31248438544984863,0.2725539474001189
177418,Fontbonne University,Missouri,HLC,adverse_action,"Approved the institution’s Provisional Plan and Teach-Out Agreements with the following institutions: Aquinas College Buena Vista University Culver-Stockton College Greenville University Illinois College Lindenwood University Maryville University Missouri Baptist University Quincy University Rockhurst University Southern Illinois University – Edwardsville Spalding University (not affiliated with HLC) University of Central Missouri University of Health Sciences and Pharmacy in St. Louis University of Missouri – St. Louis University of Olivet University of Wisconsin – River Falls Webster University; Approved the institution’s teach-out agreement with Westminster College in Fulton, Missouri, as an addition to the provisional plan approved by HLC’s Institutional Actions Council in April 2024. (Approved February 14, 2025); Approved the institution’s Teach-Out Agreement with Westminster College in Fulton, Missouri, as an addition to the Provisional Plan approved by HLC’s Institutional Actions Council in April 2024. (Approved September 9, 2024); Approved the institution’s Teach-Out Agreements with the following institutions as additions to the Provisional Plan approved by HLC’s Institutional Actions Council in April 2024. Goldfarb School of Nursing at Barnes-Jewish College, St. Louis, MO (Approved May 15, 2024) Southwest Baptist University, Bolivar, MO (Approved May 15, 2024) St. Cloud State University, St. Cloud, MN (Approved May 15, 2024) Saint Louis University, St. Louis, MO (Approved May 30, 2024) University of Illinois Springfield, Springfield, IL (Approved May 20, 2024) University of Saint Mary, Leavenworth, KS (Approved May 15, 2024) William Woods University, Fulton, MO (Approved May 20, 2024)",adverse_action,FALSE,FALSE,TRUE,4,2025-02-01,2025,Fontbonne University,2024,Private not-for-profit,"Private not-for-profit, 4-year or above",Four or more years,Suburb: Large,"Degree-granting, primarily baccalaureate or above",Missouri,Saint Louis,-35.69570871261378,8.938871966375874,No,Yes,No,Yes,No,Yes,8,-37.338431224405646,28.245643909103094,0,0.02481693937528545,0.05055611729019211,-54.51713395638629,27.668100353804448,-74.79489983727646,0.9232676197206418,0.05223630080486714
165866,Framingham State University,Massachusetts,NECHE,adverse_action; other,Accepted Complaints; Accepted Progress Reports; Accepted Teach Out Plan (closure of ten international locations); Deferred Teach-Out Plan (closure of ten international locations),adverse_action; other,FALSE,FALSE,TRUE,5,2025-11-20,2025,Framingham State University,2024,Public,"Public, 4-year or above",Four or more years,City: Small,"Degree-granting, primarily baccalaureate or above",Massachusetts,Framingham,-33.51400180668473,-4.8464752003824,Yes,Yes,No,Yes,No,No,2,-18.23376949399134,16.813607960857897,0.4753428944405716,0.02027651515539549,0.01036005434782608,-4.373177842565598,25.932724318264484,17.05721632921525,0.18640181219100932,0.5101450260506835
165936,Gordon College,Massachusetts,NECHE,adverse_action; other,Accepted Substantive Change Proposals; Accepted Teach-Out Plans (Associate of Arts in Bible and Theology for Northpoint Bible College Students),adverse_action; other,FALSE,FALSE,TRUE,2,2025-11-20,2025,Gordon College,2024,Private not-for-profit,"Private not-for-profit, 4-year or above",Four or more years,Rural: Fringe,"Degree-granting, primarily baccalaureate or above",Massachusetts,Wenham,-13.934084272006675,-52.34381217755192,Yes,Yes,No,Yes,No,No,1,-33.45848906540399,31.385316686658516,0,0.00148076463537036,0.09743092583616092,-29.447852760736197,-16.92267840470304,26.902415488482497,0.3921835349952534,0.16177590359205918
107044,Harding University,Arkansas,HLC,adverse_action,"Approved the institution’s teach-out plan to move the Harding School of Theology from the branch campus in Memphis, Tennessee, to the main campus in Searcy, Arkansas.",adverse_action,FALSE,FALSE,TRUE,1,2024-04-01,2024,Harding University,2024,Private not-for-profit,"Private not-for-profit, 4-year or above",Four or more years,Town: Distant,"Degree-granting, primarily baccalaureate or above",Arkansas,Searcy,0.6297008920762638,-21.82556451899218,Yes,No,No,No,Yes,No,2,-22.339314117249536,47.84689531659309,0,0.02029707920462415,0.0396314966104641,-2.321083172147002,47.41565346097765,15.955417801101046,0.378777410688331,0.15952041643911621
107080,Hendrix College,Arkansas,HLC,adverse_action; other,"Approved the institution’s request to offer distance education courses.; Approved the institution’s Teach-Out Agreement with Birmingham-Southern College, wherein Hendrix College will serve as a teach-out receiving institution for certain Birmingham-Southern College programs. (Approved April 19, ,2024)",adverse_action; other,FALSE,FALSE,TRUE,2,2025-05-01,2025,Hendrix College,2024,Private not-for-profit,"Private not-for-profit, 4-year or above",Four or more years,City: Small,"Degree-granting, primarily baccalaureate or above",Arkansas,Conway,-8.809135399673735,63.21227911212638,No,Yes,No,Yes,No,Yes,5,-21.734934096814257,15.946042917186356,0,0.01098892714385477,0.02057245080500894,-17.29490022172949,-11.52520238471418,-9.175262708791536,0.17223768547091944,0.2744216934386279
107141,John Brown University,Arkansas,HLC,adverse_action,"Approved the teach out of an additional location: JBU Rogers Center, 2807 Ajax Ave, Suite 200, Rogers, AR 72758.",adverse_action,FALSE,FALSE,TRUE,1,2024-04-01,2024,John Brown University,2024,Private not-for-profit,"Private not-for-profit, 4-year or above",Four or more years,Town: Distant,"Degree-granting, primarily baccalaureate or above",Arkansas,Siloam Springs,-1.9081272084805656,7.630661261182857,No,Yes,No,No,No,No,1,-25.127356697208427,29.11443270314179,0,0.04958067569316927,0.04899135446685879,-1.5283842794759823,21.638937581836423,22.43998439736387,0.42289445024167216,0.02690607311783285
238980,Lakeland University,Wisconsin,HLC,adverse_action; other,"Approved the institution’s request to offer the Bachelor of Science in Engineering Technology (120 credit hours, CIP code 15.9999).; Approved the institution’s teach out of an additional location: Lakeland University Green Bay Center, 2601 Development Drive, Green Bay, WI 54311.",adverse_action; other,FALSE,FALSE,TRUE,2,2024-07-01,2024,Lakeland University,2024,Private not-for-profit,"Private not-for-profit, 4-year or above",Four or more years,Rural: Fringe,"Degree-granting, primarily baccalaureate or above",Wisconsin,Plymouth,16.55907036797934,-23.167238402837203,Yes,No,No,Yes,Yes,Yes,4,-6.841708961273636,53.40058323460587,0,0.0045268634228561,0.00692328994738299,-18.925233644859812,20.348659535605183,-9.619106734207094,0.24639675859036372,0.5139600589591952
151810,Martin University,Indiana,HLC,adverse_action; other,"Approved the institution’s provisional plan and teach-out agreement with the following institution: University of Indianapolis, Indianapolis, IN; Continued the institution’s accreditation.",adverse_action; other,FALSE,FALSE,TRUE,2,2025-12-01,2025,Martin University,2024,Private not-for-profit,"Private not-for-profit, 4-year or above",Four or more years,City: Large,"Degree-granting, primarily baccalaureate or above",Indiana,Indianapolis,-27.669902912621357,35.864706340591454,No,Yes,No,Yes,No,No,2,-12.047724277772708,31.382353485525854,0,0,0.0134228187919463,7.894736842105263,,,0.42049497396421104,0.2480865741500252
230959,Middlebury College,Vermont,NECHE,adverse_action,"Accepted Teach-Out Plans (Middlebury Institute of International Studies at Monterey, CA)",adverse_action,FALSE,FALSE,TRUE,1,2025-11-20,2025,Middlebury College,2024,Private not-for-profit,"Private not-for-profit, 4-year or above",Four or more years,Town: Distant,"Degree-granting, primarily baccalaureate or above",Vermont,Middlebury,-0.5262050094716901,-13.12208184680436,Yes,Yes,No,Yes,Yes,Yes,4,-10.696416552109955,58.067949577873726,0,0.03773910491963707,0.11701227253491324,4.624277456647398,6.342759349222776,12.4870510428896,0.08996573644109823,0.2306753527794058
127653,Naropa University,Colorado,HLC,adverse_action; other,"Accepted the staff recommendation.; Approved the institution’s request for an aggregate change of 25% or more in credit hours for the Bachelor of Arts in Interdisciplinary Studies since the institution’s last accreditation review.; Approved the institution’s request for an aggregate change of 25% or more in program content for the Master of Arts in Religious Studies (Yoga) since the institution’s last accreditation review.; Approved the institution’s request to initiate a contractual arrangement with The Barre Center for Buddhist Studies to offer Philosophy and Religious Studies (Courses Only, 16 credit hours, CIP code 38.0001).; Approved the institution’s request to offer the Bachelor of Arts Completion Program in Interdisciplinary Studies (120 credit hours, CIP code 30.9999).; Approved the institution’s request to offer the Bachelor of Arts Completion Program in Interdisciplinary Studies (30 credit hours, CIP code 30.9999) through a contractual arrangement with Coopersmith Career Consulting.; Approved the institution’s Teach-Out Agreement with Goddard College, wherein Naropa University will serve as a teach-out receiving institution for Goddard University students. (Approved June 10, 2024)",adverse_action; other,FALSE,FALSE,TRUE,7,2024-11-01,2024,Naropa University,2024,Private not-for-profit,"Private not-for-profit, 4-year or above",Four or more years,City: Midsize,"Degree-granting, primarily baccalaureate or above",Colorado,Boulder,14.43108233117484,19.286700979429465,No,No,No,No,Yes,Yes,8,-12.309811355725756,67.24258890922611,0,0.06050616334852097,0.02344381568310428,-6.7885117493472595,-18.504483422034134,-54.22491447706093,0.2639018892687132,0.5779294976089897
239512,Northland College,Wisconsin,HLC,adverse_action; other,"Approved the institution’s Provisional Plan and Teach-Out Agreements with the following institutions: College of Atlantic, ME Gustavus Adolphus College, MN; Approved the institution’s provisional plan, including teach-out arrangements with the following institutions: Beloit College, WI College of the Atlantic, ME Ripon College, WI University of Wisconsin-Superior, WI; Approved the institution’s request for an aggregate change of 25% or more in program content for the Bachelor of Arts Pre-LAW program since the institution’s last accreditation review.; Approved the institution’s request for an aggregate change of 25% or more in program content since the last accreditation review for the following programs: Environmental Humanities Major Psychology and Social Science Major Biology Major Earth Science: Climate Science Earth Science: Geology Earth Science: Water Science Elementary/Middle (4K-9) Education Major Secondary (4-12) Science Education Major Secondary (4-12) Social Studies Education Major; Approved the institution’s Teach-Out Agreement with Evergreen State College in Olympia, WA, as an addition to the Provisional Plan approved by HLC’s Institutional Actions Council in March 2024. (Approved May 17, 2024); Approved the institution’s Teach-Out Agreements with the following institutions as additions to the Provisional Plan approved by HLC’s Institutional Actions Council in March 2024. Beloit College, Beloit, WI (Approved April 30, 2024) Lawrence University, Appleton, WI (Approved April 10, 2024) Michigan Technological University, Houghton, MI (Approved April 2, 2024) Ripon College, Ripon, WI (Approved April 10, 2024) University of Wisconsin-Superior, Superior, WI (Approved April 10, 2024) Warren Wilson College, Asheville, NC (Approved April 24, 2024); Approved the institution’s teach-out agreements with Warren Wilson College (North Carolina) and University of Wisconsin-Green Bay, as additions to the provisional plan approved by HLC’s Institutional Actions Council in March 2025. (Approved April 4, 2025); Approved the Teach-Out Agreement wherein Antioch University will be a teach-out receiving institution for Union Institute and University’s Doctor of Education in Educational and Professional Practice program. (Approved March 13, 2024)",adverse_action; other,FALSE,FALSE,TRUE,8,2025-04-01,2025,Northland College,2024,Private not-for-profit,"Private not-for-profit, 4-year or above",Four or more years,Town: Remote,"Degree-granting, primarily baccalaureate or above",Wisconsin,Ashland,-18.638573743922205,-3.8976053804788786,Yes,Yes,No,Yes,Yes,Yes,7,-23.57967493912336,32.75031990489069,0,0.03507523669693633,0.05976095617529881,-2.4390243902439024,20.05434060699603,-27.28752049817238,-0.02152365569243878,0.15782638087759443
154101,Northwestern College,Iowa,HLC,adverse_action; other; removed,"Approved the institution’s request to offer the Bachelor of Science in Engineering (127-135 credit hours, CIP code 14.0101).; Removed from Probation and placed on Notice.The institution was notified of this action on July 2, 2024. Information was posted for the public on July 3, 2024.; Withdrawal of Accreditation",adverse_action; other,FALSE,FALSE,TRUE,3,2024-06-01,2024,Northwestern College,2024,Private not-for-profit,"Private not-for-profit, 4-year or above",Four or more years,Town: Distant,"Degree-granting, primarily baccalaureate or above",Iowa,Orange City,33.564668769716086,30.072975186143257,No,No,No,No,No,No,3,-6.2472389410869935,42.36145462288871,0,0.00989615499826165,0.03306565895134624,14.285714285714285,-7.2866054724196365,10.649746715367773,0.48212405081128035,0.05689358011226984
105589,Prescott College,Arizona,HLC,adverse_action; other,"Accepted the team report and continued the institution’s accreditation.; Approved the institution’s Teach-Out Agreement with Goddard College, wherein Prescott College will serve as a teach-out receiving institution for certain Goddard College programs. (Approved April 19, 2024)",adverse_action; other,FALSE,FALSE,TRUE,2,2024-10-01,2024,Prescott College,2024,Private not-for-profit,"Private not-for-profit, 4-year or above",Four or more years,City: Small,"Degree-granting, primarily baccalaureate or above",Arizona,Prescott,9.313264346190028,4.105574729372828,No,No,No,No,No,No,1,-13.254842296167032,67.11543424951456,0,0.1043639413911998,0.00258175559380378,-28.448275862068968,-21.156552468712228,2.188435759899206,0.5769300102656487,0.3125204152501219
199582,Saint Augustine's University,North Carolina,SACSCOC,adverse_action,removed from membership,adverse_action,FALSE,FALSE,TRUE,1,2025-12-01,2025,Saint Augustine's University,2024,Private not-for-profit,"Private not-for-profit, 4-year or above",Four or more years,City: Large,"Degree-granting, primarily baccalaureate or above",North Carolina,Raleigh,15.933412604042807,-42.388293400152726,Yes,No,No,No,Yes,No,5,-56.22320618158594,25.098044687994815,0,0.3253079099698134,0.05743589743589743,-14.82889733840304,-100,-46.04684738145027,0.34346471832039355,0.5547116724416108
172264,Siena Heights University,Michigan,HLC,adverse_action,"Approved the institution’s provisional plan and teach-out agreement with the following institution: The University of Olivet, Olivet, MI; Approved the institution’s teach-out agreement with the following institution: Lawrence Technological University, Southfield, MI; Approved the institution’s teach-out agreements with the following institutions as additions to the provisional plan approved by HLC’s Institutional Actions Council in September 2025. Albertus Magnus College, New Haven, CT (Approved October 27, 2025) Benedictine University, Lisle, IL (Approved October 27, 2025) Cleary University, Howell, MI (Approved October 27, 2025)",adverse_action,FALSE,FALSE,TRUE,3,2026-01-01,2026,Siena Heights University,2024,Private not-for-profit,"Private not-for-profit, 4-year or above",Four or more years,Town: Distant,"Degree-granting, primarily baccalaureate or above",Michigan,Adrian,-26.566164154103856,-26.00350753374061,Yes,Yes,No,Yes,Yes,Yes,3,-20.022405143046115,52.74749326499734,0,0.05517575506982527,0.03239051094890511,-20.14218009478673,31.26139449184705,-18.845154968516862,0.5479164230567111,0.2140831787397723
154350,Simpson College,Iowa,HLC,adverse_action,"Approved the teach-out of the branch campus at 1415 28th St., West Des Moines, IA 50266.",adverse_action,FALSE,FALSE,TRUE,1,2024-06-01,2024,Simpson College,2024,Private not-for-profit,"Private not-for-profit, 4-year or above",Four or more years,Town: Fringe,"Degree-granting, primarily baccalaureate or above",Iowa,Indianola,-24.100719424460433,-10.433408013870272,Yes,Yes,No,Yes,Yes,Yes,7,1.0627804135008996,57.71350993781888,0,0,0.0292259083728278,-7.518796992481203,11.84855265319356,-15.227375559512623,0.08983303975228364,0.29056722638072463
183026,Southern New Hampshire University,New Hampshire,NECHE,adverse_action; other,Accepted Innovation Proposal; Accepted Requested Information Reports; Accepted Teach-Out Plans (Latin American and India Programs),adverse_action; other,FALSE,FALSE,TRUE,3,2025-11-20,2025,Southern New Hampshire University,2024,Private not-for-profit,"Private not-for-profit, 4-year or above",Four or more years,Suburb: Midsize,"Degree-granting, primarily baccalaureate or above",New Hampshire,Manchester,65.79739152472983,42.87344748890842,No,No,No,No,No,No,0,-9.638015290401494,91.8578984740423,0,0.00686484674759594,0.0072863671639217,54.854116914131446,-47.962359785169696,34.904920254244544,0.7196996223929986,0.2412604096819752
231095,Sterling College,Vermont,NECHE,adverse_action,Accepted Notification of Institutional Closure; Accepted Teach-Out Plan NA,adverse_action,FALSE,FALSE,TRUE,2,2025-12-08,2025,Sterling College,2024,Private not-for-profit,"Private not-for-profit, 4-year or above",Four or more years,Rural: Remote,"Degree-granting, primarily baccalaureate or above",Vermont,Craftsbury Common,-54.22222222222223,-24.194481217894808,Yes,Yes,Yes,Yes,No,No,2,-16.520636330507124,13.355029374647318,0,0,0.04854368932038835,-12.5,7.358181914531565,-9.446899883572325,0.2381072531873532,0.25541376015053113
149505,Trinity Christian College,Illinois,HLC,adverse_action; other,"Approved the institution’s provisional plan and teach-out agreements with the following institutions:Calvin University, Grand Rapids, MICarroll University, Waukesha, WIDominican University, River Forest, ILJudson University, Elgin, ILLewis University, Romeoville, ILNorth Park University, Chicago, ILOlivet Nazarene University, Bourbonnais, ILSaint Xavier University, Chicago, ILWheaton College, Wheaton, IL; Approved the institution’s teach-out agreement with the following institution (Approved February 5, 2026): Governors State University, University Park, IL; Approved the institution’s teach-out agreement with the following institution: Kuyper College, Grand Rapids, MI; Continued the institution’s accreditation.",adverse_action; other,FALSE,FALSE,TRUE,4,2026-02-01,2026,Trinity Christian College,2024,Private not-for-profit,"Private not-for-profit, 4-year or above",Four or more years,Suburb: Large,"Degree-granting, primarily baccalaureate or above",Illinois,Palos Heights,-37.199725463280714,-6.461392343780497,Yes,Yes,No,Yes,No,Yes,6,-19.51440526952684,36.88774601064011,0,0.01013752010270973,0.07759562841530054,-16.05351170568562,23.22893731278247,-27.88670751522797,0.4855439624965202,0.309433382639607
237312,University of Charleston,West Virginia,HLC,adverse_action,"Approved the institution’s provisional plan to teach out students enrolled in the Doctor of Pharmacy degree program, including a teach-out arrangement with West Virginia University (Morgantown, WV).",adverse_action,FALSE,FALSE,TRUE,1,2025-01-01,2025,University of Charleston,2024,Private not-for-profit,"Private not-for-profit, 4-year or above",Four or more years,City: Small,"Degree-granting, primarily baccalaureate or above",West Virginia,Charleston,11.148365465213748,-17.550576686039925,Yes,No,No,No,No,No,2,-51.230724244013985,48.11762768717679,0,0.13231715794424218,0.04348919054801407,-1.5486725663716814,2.382505669033172,13.514630790540432,0.3779059694436334,0.1613898438583441
153278,University of Dubuque,Iowa,HLC,adverse_action,"Approved the institution’s provisional plan to teach out students enrolled at the additional location: Parkway Plaza Building, 3071 E. Franklin Road, Suite 204 Meridian, ID 83642.; Approved the institution’s teach out of an additional location: 2900 S. Diablo Way, Suite D281, Tempe, AZ 85282.",adverse_action,FALSE,FALSE,TRUE,2,2025-11-01,2025,University of Dubuque,2024,Private not-for-profit,"Private not-for-profit, 4-year or above",Four or more years,City: Small,"Degree-granting, primarily baccalaureate or above",Iowa,Dubuque,-22.560296846011138,68.6104656307258,No,Yes,No,Yes,No,No,4,9.74754988373515,35.298377214250436,0,4.7582627891141447e-4,0.0287494010541447,-2.803738317757009,-18.368775113515497,49.73895557842436,0.3861860116564282,0.16971920145395092
