unitid,tracker_name,tracker_state,accreditors,action_types,action_labels,active_actions,has_active_warning,has_active_warning_or_notice,has_active_adverse_action,action_count,latest_action_date,latest_action_year,institution_name,year,control_label,sector,level,urbanization,category,state,city,enrollment_pct_change_5yr,revenue_pct_change_5yr,revenue_decreased_5yr,enrollment_decreased_5yr,revenue_10pct_drop_last_3_of_5,enrollment_decline_last_3_of_5,ended_2024_at_loss,losses_last_3_of_5,loss_years_last_10,net_tuition_per_fte_change_5yr,tuition_dependence_pct,state_funding_pct_core_revenue,federal_grants_contracts_pell_adjusted_pct_core_revenue,pct_international_all,staff_total_headcount_pct_change_5yr,discount_pct_change_5yr,endowment_pct_change_5yr,liquidity,leverage
206525,Wittenberg University,Ohio,HLC,adverse_action; probation,"Approved the institution’s provisional plan and teach-out agreements to teach out students enrolled in the following programs: Bachelor of Arts in East Asian Studies, Bachelor of Arts in German, Bachelor of Arts in Music, Bachelor of Music Education in Music, and the Bachelor of Arts in Spanish. The approved teach-out agreements are with the following institutions: Capital University, OH Baldwin Wallace University, OH University of Dayton, OH; On Probation; Placed on Probation.The institution was notified of this action on November 11, 2025. Information was posted for the public on November 12, 2025.",adverse_action; probation,TRUE,TRUE,TRUE,3,2025-11-01,2025,Wittenberg University,2024,Private not-for-profit,"Private not-for-profit, 4-year or above",Four or more years,City: Small,"Degree-granting, primarily baccalaureate or above",Ohio,Springfield,-30.319959370238696,-36.864923561214965,Yes,Yes,Yes,Yes,Yes,Yes,4,-25.527924219998315,39.65140870856854,0,0.01293319517969569,0.00801749271137026,-20.698254364089777,7.5492504076064835,-33.91065170458757,0.1496715433079375,0.27036344089650843
108232,Academy of Art University,California,WASC Senior College and University Commission,notice; removed,Following a Special Visit – Issue a Formal Notice of Concern; Following a Special Visit – Remove Notice of Concern/Issue a Warning,notice,FALSE,TRUE,FALSE,3,2026-02-01,2026,Academy of Art University,2024,Private for-profit,"Private for-profit, 4-year or above",Four or more years,City: Large,"Degree-granting, primarily baccalaureate or above",California,San Francisco,-37.840616966580974,-46.17039444164476,Yes,Yes,Yes,Yes,No,No,1,1.0771190442620269,95.4807230871318,,,0.17428807751388398,-36.17354939884997,,,,0.7521338121550494
109785,Azusa Pacific University,California,WASC Senior College and University Commission,warning,"Following a Special Visit – Remove the Warning, Issue a Formal Notice of Concern, Reaffirm Accreditation for 6 Years",warning,TRUE,TRUE,FALSE,2,2024-06-01,2024,Azusa Pacific University,2024,Private not-for-profit,"Private not-for-profit, 4-year or above",Four or more years,Suburb: Large,"Degree-granting, primarily baccalaureate or above",California,Azusa,-33.2432660643418,-41.14624940580137,Yes,Yes,No,Yes,Yes,Yes,6,-25.15544619913014,71.09900010494259,0,0.0466415085125541,0.03933721224386542,-32.16007714561234,-1.2191231026127871,-0.8001119114896241,0.3104507060666176,0.468659186230615
112570,California College of ASU,California,WASC Senior College and University Commission,warning,Following a Special Visit – Continue a Warning,warning,TRUE,TRUE,FALSE,2,2025-06-01,2025,California College of ASU,2024,Private not-for-profit,"Private not-for-profit, 4-year or above",Four or more years,City: Large,"Degree-granting, primarily baccalaureate or above",California,Los Angeles,-71.32867132867133,-90.1717033841438,Yes,Yes,Yes,Yes,Yes,Yes,6,-10.604583277111326,97.42024388883338,0,0,0.00609756097560975,-38.853503184713375,,,-0.2771121552604699,1.2771121552604698
110574,California State University-East Bay,California,WASC Senior College and University Commission,notice,Reaffirm Accreditation for 6 Years/Issue a Notice of Concern,notice,FALSE,TRUE,FALSE,2,2025-06-01,2025,California State University-East Bay,2024,Public,"Public, 4-year or above",Four or more years,Suburb: Large,"Degree-granting, primarily baccalaureate or above",California,Hayward,-18.57782090678743,-3.9514532941418032,Yes,Yes,No,Yes,No,No,4,-13.386653507833309,20.076011031970957,0.4487245760554619,6.401059020666834e-4,0.07779911275905449,-14.977220956719815,6.5409503118096985,33.85615050036675,-1.427975794877533,1.95649403594452
115083,Golden Gate University,California,WASC Senior College and University Commission,notice,Following a Special Visit – Continue Formal Notice of Concern; Reaffirm Accreditation for 6 Years/Continue the Notice of Concern,notice,FALSE,TRUE,FALSE,2,2025-06-01,2025,Golden Gate University,2024,Private not-for-profit,"Private not-for-profit, 4-year or above",Four or more years,City: Large,"Degree-granting, primarily baccalaureate or above",California,San Francisco,73.49896480331263,-30.13007334559973,Yes,No,No,No,Yes,Yes,9,-83.51991617454662,74.62334332620775,0,0.00756436108005099,0.08131605864302761,-40.06677796327212,-37.10429744188837,-14.007709089966031,0.2720275674926317,0.34280074174877867
166018,Hampshire College,Massachusetts,NECHE,other; show_cause,Accepted Progress Reports; Asked to Show Cause for Probation or Withdrawal of Accreditation for not meeting the Standard on Institutional Resources,other; show_cause,TRUE,TRUE,FALSE,2,2026-03-05,2026,Hampshire College,2024,Private not-for-profit,"Private not-for-profit, 4-year or above",Four or more years,Rural: Fringe,"Degree-granting, primarily baccalaureate or above",Massachusetts,Amherst,-37.469586374695865,-58.686202600104586,Yes,Yes,No,Yes,Yes,Yes,5,-53.607355269741575,30.733105192440902,0,0.02878061012862898,0.06744487678339818,-11.702127659574469,39.55095641654095,-61.11386174293991,0.13601941680340027,0.3884715699640785
177551,Harris-Stowe State University,Missouri,HLC,notice; other,"Approved the institution’s request to offer the Master of Business Administration (30 credit hours, CIP code 52.0201).; Denied the institution’s request to offer the Master of Business Administration.; Removed from Notice.",notice; other,FALSE,TRUE,FALSE,3,2025-09-01,2025,Harris-Stowe State University,2024,Public,"Public, 4-year or above",Four or more years,City: Large,"Degree-granting, primarily baccalaureate or above",Missouri,Saint Louis,-32.51008064516129,-12.215286253682176,Yes,Yes,No,Yes,Yes,Yes,6,-21.157632976906612,9.63947205485847,0.365764017785264,0.14254083291153125,0.03958177744585511,6.790123456790123,0.0068106635022049,97.74829343929495,-0.3614172414163776,0.5097990293885651
157058,Kentucky State University,Kentucky,SACSCOC,other; probation,placed on Probation Good Cause; Public Disclosure Statement,other; probation,TRUE,TRUE,FALSE,2,2025-12-01,2025,Kentucky State University,2024,Public,"Public, 4-year or above",Four or more years,Town: Distant,"Degree-granting, primarily baccalaureate or above",Kentucky,Frankfort,-20.33898305084746,52.48243971083383,No,Yes,No,Yes,No,No,6,75.00849448737017,17.390489109836402,0.26598064692602685,0.0647827969981575,0.03593380614657211,-10.619469026548671,-81.8205070732696,-1.0501031011147652,-0.23634969867425193,0.8277514029188016
213367,La Salle University,Pennsylvania,MSCHE,warning,Non-Compliance Warning,warning,TRUE,TRUE,FALSE,1,,,La Salle University,2024,Private not-for-profit,"Private not-for-profit, 4-year or above",Four or more years,City: Large,"Degree-granting, primarily baccalaureate or above",Pennsylvania,Philadelphia,-34.70982142857143,-36.34982378398568,Yes,Yes,No,Yes,Yes,Yes,6,-23.20723762470383,52.84438323230658,0,0.00279685556964926,0.0344017094017094,-29.310344827586203,15.374690619303411,-34.36257779590393,0.02095639970511696,0.6747018933158382
118693,Menlo College,California,WASC Senior College and University Commission,notice,Following a Special Visit – Continue a Formal Notice of Concern,notice,FALSE,TRUE,FALSE,1,2024-06-01,2024,Menlo College,2024,Private not-for-profit,"Private not-for-profit, 4-year or above",Four or more years,Suburb: Large,"Degree-granting, primarily baccalaureate or above",California,Atherton,4.823529411764706,17.500557698964318,No,No,No,No,No,No,4,-23.1536470741561,33.15883925976627,0,0.01710448205373407,0.244668911335578,13.526570048309178,10.131163239836791,-24.35571550165519,0.517557103427087,0.1220518982722804
190114,Metropolitan College of New York,New York,MSCHE,show_cause,Non-Compliance Show Cause,show_cause,TRUE,TRUE,FALSE,1,,,Metropolitan College of New York,2024,Private not-for-profit,"Private not-for-profit, 4-year or above",Four or more years,City: Large,"Degree-granting, primarily baccalaureate or above",New York,New York,-35.5067785668173,-47.310537616555266,Yes,Yes,Yes,Yes,Yes,No,3,1.1820594055169305,82.89294095427259,0.00359688814412735,0.03333959140251665,0.06106106106106106,-42.333333333333336,-19.895621700392542,4.67876172016908,0.1896240709373545,0.7575562581532618
119775,Newschool of Architecture and Design,California,WASC Senior College and University Commission,warning,"Following a Special Visit – Remove the Warning, Issue a Formal Notice of Concern",warning,TRUE,TRUE,FALSE,1,2024-02-01,2024,Newschool of Architecture and Design,2024,Private for-profit,"Private for-profit, 4-year or above",Four or more years,City: Large,"Degree-granting, primarily baccalaureate or above",California,San Diego,-48.037676609105176,-45.48605208850056,Yes,Yes,No,Yes,No,Yes,9,8.63391337372651,72.88844232407445,,,0.03323262839879154,-21.875,,,,0.6588054846554061
120184,Notre Dame de Namur University,California,WASC Senior College and University Commission,removed; warning,"Following a Special Visit – Remove Notice of Concern; Following a Special Visit – Remove the Warning, Issue a Formal Notice of Concern",warning,TRUE,TRUE,FALSE,2,2026-02-01,2026,Notre Dame de Namur University,2024,Private not-for-profit,"Private not-for-profit, 4-year or above",Four or more years,Suburb: Large,"Degree-granting, primarily baccalaureate or above",California,Belmont,-81.80262407301768,-80.3131958277773,Yes,Yes,Yes,Yes,Yes,Yes,6,-30.219308016664836,37.30927468307043,0,0.09910976719262396,0.05329153605015674,-49.65986394557823,-100,-22.8531990762414,-0.03125755183803618,0.6062440177913065
455770,Providence Christian College,California,WASC Senior College and University Commission,probation,Following an Accreditation Visit – Impose Probation,probation,TRUE,TRUE,FALSE,1,2025-02-01,2025,Providence Christian College,2024,Private not-for-profit,"Private not-for-profit, 4-year or above",Four or more years,City: Midsize,"Degree-granting, primarily baccalaureate or above",California,Pasadena,-13.966480446927374,-14.087369155010098,Yes,Yes,No,Yes,Yes,No,4,-17.955581389000212,20.5579655486813,0,0.07384100653906436,0.00649350649350649,-15.254237288135592,,-24.7960515402747,-0.08247359127713116,1.071982560028619
186283,Rider University,New Jersey,MSCHE,probation,Non-Compliance Probation,probation,TRUE,TRUE,FALSE,1,,,Rider University,2024,Private not-for-profit,"Private not-for-profit, 4-year or above",Four or more years,Suburb: Large,"Degree-granting, primarily baccalaureate or above",New Jersey,Lawrenceville,-9.03725562523054,-34.88879682981189,Yes,Yes,No,Yes,Yes,Yes,7,-28.707151248215705,55.39523263100499,0.01608848136567227,0.01685962984872813,0.040551500405515,-34.55149501661129,6.847708718824657,-18.213297849549978,-0.1013289670706308,0.7164332950154191
123554,Saint Mary's College of California,California,WASC Senior College and University Commission,notice,"Reaffirm Accreditation for 6 Years, Issue a Formal Notice of Concern",notice,FALSE,TRUE,FALSE,1,2024-02-01,2024,Saint Mary's College of California,2024,Private not-for-profit,"Private not-for-profit, 4-year or above",Four or more years,Suburb: Large,"Degree-granting, primarily baccalaureate or above",California,Moraga,-29.427792915531334,-39.24295425275286,Yes,Yes,Yes,Yes,Yes,Yes,5,-28.9290873413224,61.02264360489821,0,0.02381773399014778,0.0324967824967825,-47.46247319513939,25.982015431481297,-19.594196514277545,0.128648836194395,0.3791048983652238
152381,Saint Mary-of-the-Woods College,Indiana,HLC,notice,"On Notice; Placed on Notice.The institution was notified of this action on July 8, 2025. Information was posted for the public on July 9, 2025.",notice,FALSE,TRUE,FALSE,2,2025-06-01,2025,Saint Mary-of-the-Woods College,2024,Private not-for-profit,"Private not-for-profit, 4-year or above",Four or more years,Rural: Fringe,"Degree-granting, primarily baccalaureate or above",Indiana,Saint Mary of the Woods,15.806715806715808,19.280033644349732,No,No,No,No,Yes,Yes,7,-25.430593438969208,50.58211500459727,0,0.00577643244373757,0.01626591230551626,18.0327868852459,50.335025784820395,-28.151157168552444,-0.2674521423825273,0.8125592687076679
112084,San Diego Christian College,California,WASC Senior College and University Commission,show_cause; warning,"Following a Special Visit – Remove an Order to Show Cause, Issue a Warning, Issue a Good Cause Extension; Following an Interim Report Review – Remove a Warning, Issue a Notice of Concern",show_cause; warning,TRUE,TRUE,FALSE,2,2025-05-01,2025,San Diego Christian College,2024,Private not-for-profit,"Private not-for-profit, 4-year or above",Four or more years,Suburb: Large,"Degree-granting, primarily baccalaureate or above",California,Santee,-80.54474708171206,-74.81651028661874,Yes,Yes,Yes,Yes,Yes,No,3,-27.35306234172181,41.9495398164386,0,0.0189261316706772,0.03333333333333333,-78.81773399014779,-19.090414634314016,-17.045780227746793,-0.44194979763192055,1.3220033808541831
123572,Sonoma State University,California,WASC Senior College and University Commission,notice,Defer Action on Reaffirmation of Accreditation/Issue a Notice of Concern,notice,FALSE,TRUE,FALSE,1,2026-02-01,2026,Sonoma State University,2024,Public,"Public, 4-year or above",Four or more years,Suburb: Large,"Degree-granting, primarily baccalaureate or above",California,Rohnert Park,-35.37644787644788,-17.379450147991648,Yes,Yes,No,Yes,No,No,4,-13.177342711741083,13.320905344245404,0.4794855335146124,0.04490188340377143,0.00716952949962658,-18.7593423019432,17.262725729990123,7.570722806585891,-0.829487871650517,1.38290457966001
141565,University of Hawaii at Hilo,Hawaii,WASC Senior College and University Commission,notice; removed,Following a Special Visit – Continue a Formal Notice of Concern; Following a Special Visit – Remove Notice of Concern,notice,FALSE,TRUE,FALSE,2,2025-06-01,2025,University of Hawaii at Hilo,2024,Public,"Public, 4-year or above",Four or more years,Town: Remote,"Degree-granting, primarily baccalaureate or above",Hawaii,Hilo,-17.2985187044941,1.4494508632629193,No,Yes,No,Yes,No,No,6,-40.802082982967,10.44529060065056,0.3407185783930768,0.1330632701192349,0.04341226472374013,-5.980066445182724,14.66259172187624,8.638302933486784,0.08911124638697045,0.1478437379865759
210304,Warner Pacific University,Oregon,NWCCU,warning,"Accept the Reports, Continue Sanction of Warning",warning,TRUE,TRUE,FALSE,1,2025-07-01,2025,Warner Pacific University,2024,Private not-for-profit,"Private not-for-profit, 4-year or above",Four or more years,City: Large,"Degree-granting, primarily baccalaureate or above",Oregon,Portland,-42.93785310734463,-15.705271870259493,Yes,Yes,No,Yes,Yes,Yes,9,-13.081363882873564,46.98102374638097,0,0.03287391159921921,0.00247524752475247,33.95061728395062,3.504150195843504,-21.5048698495092,0.13031581720316532,0.4961928292769413
206491,Wilberforce University,Ohio,HLC,notice; other,"Approved the institution’s request to offer the Bachelor of Science in Civil Engineering (124 credit hours, CIP code 14.0801).; Approved the institution’s request to offer the Bachelor of Science in Environmental Engineering (124 credit hours, CIP code 14.1401).; Approved the institution’s request to offer the Bachelor of Science in Kinesiology (121 credit hours, CIP code 31.0505).; Removed from Notice.",notice; other,FALSE,TRUE,FALSE,4,2025-06-01,2025,Wilberforce University,2024,Private not-for-profit,"Private not-for-profit, 4-year or above",Four or more years,Rural: Fringe,"Degree-granting, primarily baccalaureate or above",Ohio,Wilberforce,-8.530183727034121,-38.73014020551,Yes,Yes,No,Yes,Yes,No,6,-48.52586508098527,36.42671788138882,0,0.3715806454209375,0.00143472022955523,38.21138211382114,227.89814513126285,-13.8202443015999,0.09137814426864428,0.5745870865281333
125897,Woodbury University,California,WASC Senior College and University Commission,notice; removed,"Following a Special Visit – Remove Notice of Concern; Reaffirm Accreditation for 6 Years, Issue a Formal Notice of Concern",notice,FALSE,TRUE,FALSE,2,2025-06-01,2025,Woodbury University,2024,Private not-for-profit,"Private not-for-profit, 4-year or above",Four or more years,City: Large,"Degree-granting, primarily baccalaureate or above",California,Burbank,-28.826151560178303,-23.105594489480755,Yes,Yes,No,Yes,Yes,Yes,8,-44.82127015289178,25.769415650503767,0,0.03304478898326624,0.0615866388308977,,44.68036376089959,-73.04018652515968,0.11751225418281216,0.6739500826601351
238193,Alverno College,Wisconsin,HLC,adverse_action,"Approved the institution’s provisional plan to teach out students at the branch campus at Ann Arbor, 4090 Geddes Road, Ann Arbor, MI 48105, including teach-out agreements with the following institutions: Madonna University, MI Lourdes University, OH Siena Heights University, MI Rochester Christian University, MI University of Detroit Mercy, MI; Approved the institution’s provisional plan to teach out students enrolled in the Master of Science in Social Work, including teach-out agreements with the following institutions: Concordia University, Wisconsin, WI University of Wisconsin-Milwaukee, WI Concordia University, Mequon, WI",adverse_action,FALSE,FALSE,TRUE,2,2025-02-01,2025,Alverno College,2024,Private not-for-profit,"Private not-for-profit, 4-year or above",Four or more years,City: Large,"Degree-granting, primarily baccalaureate or above",Wisconsin,Milwaukee,5.042436345481778,-32.14921916742573,Yes,No,No,Yes,Yes,Yes,7,-45.44809974980807,67.0872564763358,0,0.04860244325096254,0.01948669201520912,-31.27853881278539,12.692298925795404,-6.765037032589204,0.3113359290551242,0.2753933818046454
105899,Arizona Christian University,Arizona,HLC,adverse_action; other,"Approved the institution’s provisional plan to teach out students enrolled in the Bachelor of Arts in Biblical and Theological Studies, Bachelor of Arts in Child Development, Bachelor of Science in Secondary Education, and Master of Arts in Education, including the teach-out agreement with Houston Christian University.; Approved the institution’s request for approval for a change in program content and credit hours for the Bachelor of Science in Secondary Education with a Concentration in Bible program (120 credit hours, CIP code 13.1205) since the institution’s last accreditation review.",adverse_action; other,FALSE,FALSE,TRUE,2,2025-11-01,2025,Arizona Christian University,2024,Private not-for-profit,"Private not-for-profit, 4-year or above",Four or more years,Suburb: Large,"Degree-granting, primarily baccalaureate or above",Arizona,Glendale,59.62660443407235,-24.9649636688181,Yes,No,No,No,No,Yes,5,-5.660969652552997,48.95894406377437,0,0.00224164848017263,0.02558479532163742,-2.515723270440252,3.380305948372311,-40.656839115690005,0.21280203604646283,0.6759087017580264
106458,Arkansas State University,Arkansas,HLC,adverse_action; other,"Approved the institution’s Provisional Plan to teach out students enrolled in the Certificate and Associate of Applied Science in Emergency Management Services, including the teach-out agreement with New York Institute of Technology College of Osteopathic Medicine.; Approved the institution’s request to offer the Bachelor of Science in Engineering Management Systems (CIP code 15.1501); Bachelor of Science in Digital Technology & Design (CIP code 9.0999); Bachelor of Science in Computer Science (CIP code 11.0101); Bachelor of Arts in Psychology (CIP code 42.0101), Bachelor of Special Education (K-12) (CIP code 13.1099); and Master of Special Education in Educational Leadership (CIP code 13.0408) through a contractual arrangement with Global Studies Institute.; Approved the institution’s request to offer the Doctor of Veterinary Medicine (152.5 credit hours, CIP code 01.8001).; Approved the institution’s request to open an additional location: A-State Qatar, Otba Bin Mohammed Street, Mehairja, Dohta, Qatar.",adverse_action; other,FALSE,FALSE,TRUE,4,2026-02-01,2026,Arkansas State University,2024,Public,"Public, 4-year or above",Four or more years,City: Small,"Degree-granting, primarily baccalaureate or above",Arkansas,Jonesboro,7.040101175106709,-10.215108329930391,Yes,No,No,Yes,Yes,No,2,-22.894859989464027,21.994464993112096,0.3463899023840007,0.0596604952667425,0.07354895879486044,-7.45041122399613,3.386821735773065,16.55245163821775,0.14764647562957584,0.32784076198305184
201195,Baldwin Wallace University,Ohio,HLC,adverse_action; other,"Approved the institution’s provisional plan for a teach out of students enrolled at the following additional location: 4400 Richmond Road, Warrensville Heights, OH 44128.; Approved the institution’s request to offer the Master of Arts in Clinical Mental Health Counseling (60 credit hours, CIP code 51.1508).",adverse_action; other,FALSE,FALSE,TRUE,2,2024-11-01,2024,Baldwin Wallace University,2024,Private not-for-profit,"Private not-for-profit, 4-year or above",Four or more years,Suburb: Large,"Degree-granting, primarily baccalaureate or above",Ohio,Berea,-16.94760820045558,-14.111536920794906,Yes,Yes,No,Yes,Yes,Yes,5,-16.339623002664215,49.32655558765072,0,0.02452003855542881,0.01234229292375205,-8.641975308641975,20.71581581664199,-18.348097598229995,0.20805933973441496,0.15511997353296406
238333,Beloit College,Wisconsin,HLC,adverse_action,"Approved the institution’s Teach-Out Agreement with Wells College, wherein Beloit College will serve as a teach-out receiving institution for Wells College students. (Approved June 14, 2024)",adverse_action,FALSE,FALSE,TRUE,1,2024-06-01,2024,Beloit College,2024,Private not-for-profit,"Private not-for-profit, 4-year or above",Four or more years,City: Small,"Degree-granting, primarily baccalaureate or above",Wisconsin,Beloit,-21.682378535170415,-1.3632818409099876,Yes,Yes,No,Yes,No,No,4,-36.640027675858306,25.49250404787813,0,0.2214150114338508,0.15092592592592594,-8.49056603773585,10.0832844922731,-49.92788590721238,0.2605686987868913,0.14898947557173622
164988,Boston University,Massachusetts,NECHE,adverse_action,"Accepted Teach-Out Plans (Master of Social Work degree at its Bedford, Cape Cod, and Fall River locations)",adverse_action,FALSE,FALSE,TRUE,1,2025-11-20,2025,Boston University,2024,Private not-for-profit,"Private not-for-profit, 4-year or above",Four or more years,City: Large,"Degree-granting, primarily baccalaureate or above",Massachusetts,Boston,6.080086023516211,2.8537991620497105,No,No,No,Yes,No,No,1,-18.12225572226152,46.419677167080096,0,0.14481742473275533,0.28052005288673426,9.65104117143672,22.106176482183667,24.42020944518099,0.4302296091603834,0.2983145095277736
152992,Briar Cliff University,Iowa,HLC,adverse_action,Approved the institution’s provisional plan to teach out students enrolled in the Doctor of Occupational Therapy.,adverse_action,FALSE,FALSE,TRUE,1,2024-11-01,2024,Briar Cliff University,2024,Private not-for-profit,"Private not-for-profit, 4-year or above",Four or more years,City: Small,"Degree-granting, primarily baccalaureate or above",Iowa,Sioux City,-18.419144307469185,-7.699445515626037,Yes,Yes,No,Yes,No,Yes,6,-29.10067367700578,35.966015147552376,0,0.06252227767822437,0.1342222222222222,-1.351351351351351,22.69233167935273,15.738635827382277,0.09264912110383232,0.48269305979031174
